,Unnamed: 0.1,operation,property_type,place_name,place_with_parent_names,country_name,state_name,geonames_id,lat-lon,lat,lon,price,currency,price_aprox_local_currency,price_aprox_usd,surface_total_in_m2,surface_covered_in_m2,price_usd_per_m2,price_per_m2,floor,rooms,expenses,properati_url,description,title,image_thumbnail,surface_total_in_m2_reliable,surface_covered_in_m2_reliable,rooms_number,rooms_1,rooms_number_2,rooms_2,rooms_3,pileta,galeria,seguridad,sotano,amenities,terraza,metrobus,subte,cochera,consultorio,place_name_raw,rooms_log,rooms_log_squared,surface_uncovered,surface_uncovered_log,has_surface_uncovered,surface_total_log,surface_total_log_squared,pileta_True,galeria_True,seguridad_True,sotano_True,amenities_True,terraza_True,metrobus_True,subte_True,cochera_True,consultorio_True,has_surface_uncovered_True,property_type_apartment,property_type_house,property_type_store,place_name_Almagro,place_name_Balvanera,place_name_Barracas,place_name_Barrio Norte,place_name_Belgrano,place_name_Boca,place_name_Boedo,place_name_Caballito,place_name_Capital Federal,place_name_Centro / Microcentro,place_name_Chacarita,place_name_Coghlan,place_name_Colegiales,place_name_Congreso,place_name_Constitución,place_name_Flores,place_name_Floresta,place_name_Las Cañitas,place_name_Liniers,place_name_Mataderos,place_name_Monserrat,place_name_Nuñez,place_name_Once,place_name_Otros barrios,place_name_Palermo,place_name_Palermo Chico,place_name_Palermo Hollywood,place_name_Palermo Soho,place_name_Parque Chacabuco,place_name_Parque Patricios,place_name_Paternal,place_name_Puerto Madero,place_name_Recoleta,place_name_Retiro,place_name_Saavedra,place_name_San Cristobal,place_name_San Nicolás,place_name_San Telmo,place_name_Tribunales,place_name_Villa Crespo,place_name_Villa Devoto,place_name_Villa Lugano,place_name_Villa Luro,place_name_Villa Pueyrredón,place_name_Villa Urquiza,place_name_Villa del Parque,rooms_log_scaled,rooms_log_squared_scaled,surface_covered_in_m2_scaled,surface_uncovered_log_scaled,surface_total_log_scaled,surface_total_log_squared_scaled,price_usd_per_m2_pred,price_aprox_usd_pred,sobrevaluado,subvaluado,magnitud_sobrevaluacion,magnitud_subvaluacion
110357,110357,sell,apartment,Belgrano,|Argentina|Capital Federal|Belgrano|,Argentina,Capital Federal,3436077.0,"-34.563643,-58.4594633",-34.563643,-58.45946329999999,199000.0,USD,3511255.5,199000.0,66.0,60.0,3015.151515151515,3316.666666666666,,3.0,,http://www.properati.com.ar/1c3kk_venta_departamento_belgrano_balcon_luminoso_garage_aire-acondicionado_losa-radiante_subte-linea-d_inmobiliaria-calot_gqd,"Departamento 3 AMBIENTES, muy luminoso. Living comedor con balcón al frente. Cocina independiente. 2 dormitorios hiper luminosos con amplios placards. Aire acondicionado. Calefacción por losa radiante. COCHERA FIJA Y CUBIERTA. Baño completo con bañera. SEGURIDAD. - Teléfono:  -  - ",MUY LUMINOSO // JURAMENTO 2700,https://thumbs4.properati.com/6/wHJtXhz4yFMJmcZp_TG0t46cSbw=/trim/198x0/smart/filters:strip_icc()/itdriver.ddns.net/websinca/public/images/3501/clp3501_3.jpg,True,True,2.0,3.0,,3.0,3.0,False,False,True,False,False,False,False,False,True,False,Belgrano,1.3862943611198906,1.9218120556728056,6.0,1.9459101490553132,True,4.189654742026425,17.553206857384513,0,0,1,0,0,0,0,0,1,0,1,1,0,0,0,0,0,0,1,0,0,0,0,0,0,0,0,0,0,0,0,0,0,0,0,0,0,0,0,0,0,0,0,0,0,0,0,0,0,0,0,0,0,0,0,0,0,0,0,0,0.29835701951596716,0.1955983781628041,-0.16413086660147194,0.31854900357260535,-0.10724399551405486,-0.17126568703425715,3245.224408259898,214184.81094515327,False,False,0.929104165332052,1.0763055826389611
22291,22291,sell,house,Villa Devoto,|Argentina|Capital Federal|Villa Devoto|,Argentina,Capital Federal,3427451.0,"-34.5873108,-58.511576",-34.5873108,-58.511576,425000.0,USD,7498912.5,425000.0,205.0,205.0,2073.170731707317,2073.170731707317,,,,http://www.properati.com.ar/17i89_venta_casa_villa-devoto_suite_lavadero_parrilla_patio_terraza_vestidor_luminoso_garage_sotelo-propiedades_f7b,"Chalet 5 Ambientes sobre un lote de casi 30 m (8.66 x 29.50 m) con 2 cocheras y fondo libre.En planta baja: living comedor en desnivel, cocina, comedor diario, dormitorio, escritorio, baño, patio y fondo libre de 8.66 x 12 con parrilla y lavadero.En planta alta: 3 dormitorios, el principal en suite con vestidor, baño y terraza al contrafrente.Muy cuidada, solida casa y muy buena orientación.","Casa 5 ambientes   escritorio, fondo libre y 2 cocheras ",https://thumbs4.properati.com/3/bS-7NrJKmM-AjARiqTqcgB-fIhU=/trim/198x0/smart/filters:strip_icc()/static.sumaprop.com/368/466633/files/4992551.jpg,True,True,3.0,3.0,5.0,3.0,3.0,False,False,False,False,False,True,False,False,True,False,Villa Devoto,1.3862943611198906,1.9218120556728056,0.0,0.0,False,5.3230099791384085,28.334435238007078,0,0,0,0,0,1,0,0,1,0,0,0,1,0,0,0,0,0,0,0,0,0,0,0,0,0,0,0,0,0,0,0,0,0,0,0,0,0,0,0,0,0,0,0,0,0,0,0,0,0,0,0,0,0,1,0,0,0,0,0,0.29835701951596716,0.1955983781628041,0.7463579926497323,-1.0085025601740178,1.4479619943510036,1.377695382857032,1958.4827568809137,401488.96516058734,False,False,1.058559604072826,0.9446799180249114
111784,111784,sell,apartment,Monserrat,|Argentina|Capital Federal|Monserrat|,Argentina,Capital Federal,3430570.0,"-34.6197919041,-58.3813379478",-34.6197919041,-58.3813379478,97000.0,USD,1711516.5,97000.0,47.0,41.0,2063.8297872340427,2365.853658536585,,,1000.0,http://www.properati.com.ar/1c65s_venta_departamento_monserrat_calvo-carlos_1100_piscina_aire-acondicionado_subte-linea-e_subte-linea-c_le-bleu_giv,"Departamentos en venta con  piso flotante melamínico y zocalos. Muebles de cocina bajo mesada en terminación de melamina,  mesadas de cocina granito con zócalo,  pileta de acero inoxidable,  anafe eléctrico encastrable y horno eléctrico, carpiterias de aluminio anodizado natural de dos hojas corredizas.  Calefacción y Aire acondicionado por aire mediante equipos tipo Split frío-calor.Le Bleu Negocios InmobiliariosVirrey Olaguer y Feliú 2623 C.A.B.A.Tel:   PROP LBU6192 AP464805Nº Matrícula 5691 Colegio San Isidro CUCICBA 397",Departamento - Monserrat,https://thumbs4.properati.com/3/ZIngGS6EcjzWWpMANCSFRoTOc4Y=/trim/198x0/smart/filters:strip_icc()/tbcn.s3-accelerate.amazonaws.com/water_pics/43091259818500227731663086155793592326291209504149414322741442965798355111441.jpg,True,True,,,,,3.0,True,False,False,False,False,False,False,False,False,False,Monserrat,1.3862943611198906,1.9218120556728056,6.0,1.9459101490553132,True,3.8501476017100584,14.823636554953715,1,0,0,0,0,0,0,0,0,0,1,1,0,0,0,0,0,0,0,0,0,0,0,0,0,0,0,0,0,0,0,0,0,0,1,0,0,0,0,0,0,0,0,0,0,0,0,0,0,0,0,0,0,0,0,0,0,0,0,0,0.29835701951596716,0.1955983781628041,-0.2834363033309401,0.31854900357260535,-0.5731204664848243,-0.5634286193765318,2317.407880917484,108918.17040312174,False,False,0.8905768398513225,1.122867736114657
55359,55359,sell,apartment,Barrio Norte,|Argentina|Capital Federal|Barrio Norte|,Argentina,Capital Federal,3436109.0,"-34.5895459,-58.3973636",-34.5895459,-58.39736360000001,1630000.0,ARS,1612996.49,91416.39,31.0,25.0,2948.915806451613,65200.0,,1.0,,http://www.properati.com.ar/19oye_venta_departamento_barrio-norte_balcon_lavadero_parrilla_amenities_subte-linea-d_subte-linea-h_aprop-bienes-raices,"Mono ambiente de 24.50m2 cubiertos con 3m2 de balcón Y 3m2 descubiertos. Calidad y diseño. Amenities: Laundry, solarium con ducha y Parrilla. Modernas unidades aptas profesionales. Espacios de uso flexible que permite su utilización como viviendas u oficinas. En el corazón de la Ciudad. En un entorno caracterizado por la presencia de Universidades y con inmejorables vías de comunicación. Calidad y diseño. Matriculado:Averbuj Nicoletti Mariano MartínCPI 5431Te. +54 11 ",Junín,https://thumbs4.properati.com/8/4HWGAvlpcpbZmgAux7nqMgQe2QY=/trim/198x0/smart/filters:strip_icc()/static.sumaprop.com/11565/686061/files/7044204.jpg,True,True,,1.0,,1.0,1.0,False,False,False,False,True,False,False,False,False,False,Barrio Norte,0.6931471805599453,0.4804530139182014,6.0,1.9459101490553132,True,3.4339872044851463,11.79226812056771,0,0,0,0,1,0,0,0,0,0,1,1,0,0,0,0,0,1,0,0,0,0,0,0,0,0,0,0,0,0,0,0,0,0,0,0,0,0,0,0,0,0,0,0,0,0,0,0,0,0,0,0,0,0,0,0,0,0,0,0,-1.9376934160154284,-1.6618499419786872,-0.38390403952417645,0.31854900357260535,-1.1441816142305563,-0.9989515048577952,2935.1979600203376,90991.13676063047,False,False,1.0046735677177905,0.9953481729111209
10576,10576,sell,apartment,Otros barrios,|Argentina|Capital Federal|Parque Centenario|,Argentina,Capital Federal,,"-34.6025765028,-58.4360489418",-34.602576502800005,-58.4360489418,160000.0,USD,2823120.0,160000.0,68.0,43.0,2352.9411764705883,3720.930232558139,,2.0,,http://www.properati.com.ar/168d3_venta_departamento_parque-centenario_balcon_terraza_toilette_placard_estrenar_subte-linea-b_abp-propiedades_ehu,"TRIPLEX DE 2 AMBIENTES CON TERRAZA PROPIA. A ESTRENAR. PARA OCUPAR YA!!! MUY BUENA UBICACIÓN CERCA DE TODO. A PASOS DEL PARQUE CENTENARIO. SUBTE ""B"". APTO PROFESIONAL !!! 1era PLANTA: LIVING COMEDOR. VENTANAL. COCINA INTEGRADA. TOILETTE. 2da PLANTA: DORMITORIO PLACARD. SALIDA A BALCÓN BAÑO COMPLETO. 3era PLANTA: TERRAZA PROPIA de 18 M2 . HAY QUE VERLO!!! SOLICITE ENTREVISTA!!!",TRIPLEX EN VENTA VILLA CRESPO TERRAZA PROPIA ,https://thumbs4.properati.com/0/a31VIJQCiP-ZV_I7V_WzhbBUAMw=/trim/198x0/smart/filters:strip_icc()/static.sumaprop.com/11774/573970/files/5695136.jpg,True,True,,2.0,,2.0,2.0,False,False,False,False,False,True,False,True,False,False,Parque Centenario,1.0986122886681098,1.206948960812582,25.0,3.258096538021482,True,4.219507705176107,17.804245274040536,0,0,0,0,0,1,0,1,0,0,1,1,0,0,0,0,0,0,0,0,0,0,0,0,0,0,0,0,0,0,0,0,0,0,0,0,0,1,0,0,0,0,0,0,0,0,0,0,0,0,0,0,0,0,0,0,0,0,0,0,-0.6296877615083525,-0.7256302791069891,-0.2708778363067856,1.2134202288704241,-0.06627933978624213,-0.13519848571736284,1760.9270524566282,119743.03956705071,False,False,1.3361945761399117,0.748393997294067
46807,46807,sell,apartment,Palermo Hollywood,|Argentina|Capital Federal|Palermo|Palermo Hollywood|,Argentina,Capital Federal,,"-34.5805549,-58.4317453",-34.5805549,-58.431745299999996,259000.0,USD,4569925.5,259000.0,97.0,97.0,2670.103092783505,2670.103092783505,,3.0,,http://www.properati.com.ar/196z5_venta_departamento_palermo-hollywood_balcon_baulera_sum_terraza_toilette_luminoso_garage_amenities_subte-linea-d_grupo-matienzo_g1i,"PRE - VENTA EXCLUSIVA!!!! Tres ambientes con dos baños, toilette y terraza + balcón. - Unidades de 1,2 Y 3 ambientes al frente. Edificio a desarrollarse en 7 pisos con amenities. Cocheras y Bauleras opcionales - SUM con conexión exterior - Terraza Palermo Hollywood es una ubicación que garantiza disfrutar de sus calles soleadas y tranquilas durante el día y a la vez ofrece una gran variedad de opciones de restaurantes, bares y pubs para disfrutrar de la noche de Buenos Aires.",Guatemala 5500 - Palermo Hollywood - Capital Federal,https://thumbs4.properati.com/8/678k6QtPVESqjUI4JNiUA4bVrGU=/trim/198x0/smart/filters:strip_icc()/static.sumaprop.com/439/652504/files/6605843.jpg,True,True,3.0,3.0,,3.0,3.0,False,False,False,False,True,True,False,False,True,False,Palermo Hollywood,1.3862943611198906,1.9218120556728056,0.0,0.0,False,4.574710978503383,20.927980536839378,0,0,0,0,1,1,0,0,1,0,0,1,0,0,0,0,0,0,0,0,0,0,0,0,0,0,0,0,0,0,0,0,0,0,0,0,0,0,0,0,1,0,0,0,0,0,0,0,0,0,0,0,0,0,0,0,0,0,0,0,0.29835701951596716,0.1955983781628041,0.06820077334538707,-1.0085025601740178,0.4211355855693043,0.31359493038525,3001.8321722934106,291177.7207124608,False,False,0.8894911305929327,1.1242383039091153
41712,41712,sell,apartment,Villa Lugano,|Argentina|Capital Federal|Villa Lugano|,Argentina,Capital Federal,3427408.0,"-34.6831704633,-58.4663740322",-34.6831704633,-58.4663740322,53000.0,USD,935158.5,53000.0,50.0,50.0,1060.0,1060.0,,3.0,,http://www.properati.com.ar/18uye_venta_departamento_villa-lugano_subte-premetro_am-estudio-inmobiliario-juridico-contable_eos,DEPARTAMENTO DE 3 AMB. EN EXCELENTE ESTADO.UBICADO A MTS DE AV. CRUZ Y SOLDADO D ELA FRONTERA.APTO CREDITO,EDIFICIO 110 LUGANO I Y II,"https://thumbs4.properati.com/2/cYgNhOPDSXw9dvG9YoVJquW351E=/trim/198x0/smart/filters:strip_icc()/maps.googleapis.com/maps/api/staticmap%3Fkey=AIzaSyCtB7aox9MJ3hCrd_u4KJ5N0v8syKusnaA&center=-34.6831704633,-58.4663740322&zoom=19&size=800x600&maptype=satellite&sensor=false",True,True,,3.0,,3.0,3.0,False,False,False,False,False,False,False,False,False,False,Villa Lugano,1.3862943611198906,1.9218120556728056,0.0,0.0,False,3.912023005428146,15.303923994999064,0,0,0,0,0,0,0,0,0,0,0,1,0,0,0,0,0,0,0,0,0,0,0,0,0,0,0,0,0,0,0,0,0,0,0,0,0,0,0,0,0,0,0,0,0,0,0,0,0,0,0,0,0,0,0,1,0,0,0,0,0.29835701951596716,0.1955983781628041,-0.22692320172224467,-1.0085025601740178,-0.4882141676151961,-0.4944247433131038,1518.1915391726905,75909.57695863453,False,False,0.698199122211962,1.43225616903084
117583,117583,sell,store,Capital Federal,|Argentina|Capital Federal|,Argentina,Capital Federal,3433955.0,"-34.5986962068,-58.3740746373",-34.5986962068,-58.3740746373,30000.0,USD,529335.0,30000.0,16.0,16.0,1875.0,,,,,http://www.properati.com.ar/1cdpu_venta_local_capital-federal_cordoba-av-_500_subte-linea-b_subte-linea-h_subte-linea-c_zuker-servicios-inmobiliarios_gsp,                        Oportunidad local en Galería Buenos Aires entrada a la misma por Florida o por Av Córdoba. FRENTE A GALERIAS PACIFICO - Aviso publicado por Sumaprop | Gestión Inmobiliaria Simple.                    ,Local - Microcentro,https://thumbs4.properati.com/9/iOqbRtyMxudfOG-5xPz8xaloo5I=/trim/198x0/smart/filters:strip_icc()/tbcn.s3-accelerate.amazonaws.com/pictures/16423703373866742853342909680870661029089438880172677868042191875803632574898.jpg,True,True,,,,,3.0,False,True,False,False,False,False,False,False,False,False,Capital Federal,1.3862943611198906,1.9218120556728056,0.0,0.0,False,2.772588722239781,7.687248222691222,0,1,0,0,0,0,0,0,0,0,0,0,0,1,0,0,0,0,0,0,0,0,1,0,0,0,0,0,0,0,0,0,0,0,0,0,0,0,0,0,0,0,0,0,0,0,0,0,0,0,0,0,0,0,0,0,0,0,0,0,0.29835701951596716,0.1955983781628041,-0.4404171411328719,-1.0085025601740178,-2.0517619099697435,-1.5887280858240376,2375.964085713861,38015.42537142178,False,False,0.7891533425416463,1.2671808457140592
116888,116888,sell,apartment,Recoleta,|Argentina|Capital Federal|Recoleta|,Argentina,Capital Federal,3429595.0,"-34.5904086,-58.3871223",-34.5904086,-58.3871223,500000.0,USD,8822250.0,500000.0,139.0,139.0,3597.1223021582728,3597.1223021582728,,5.0,,http://www.properati.com.ar/1cct8_venta_departamento_recoleta_baulera_suite_toilette_lujoso_dependencias_subte-linea-h_rg-montes_du0,Espectacular semipiso reciclado a nuevo en una de las mejores cuadras de Recoleta (Quintana y Montevideo). Edificio de categoría. Todo luz! Hall de entrada. Living Comedor de muy buenas dimensiones. Toilette de recepción. Tres dormitorios (uno de ellos en suite) + escritorio. Dos dormitorios comparten un baño completo. Dependencia de servicio con baño. Doble puerta de seguridad en planta baja. Baulera. Vale la pena visitarlo!,Sempiso reciclado en Quintana y Montevideo (3dorm + escr),https://thumbs4.properati.com/7/RLfESa0scP0JWrbZ_yA7i3TGUoU=/trim/198x0/smart/filters:strip_icc()/static.sumaprop.com/151/711027/files/7431440.jpg,True,True,,5.0,,5.0,5.0,False,False,True,False,False,False,False,False,False,False,Recoleta,1.791759469228055,3.210401995568401,0.0,0.0,False,4.9344739331306915,24.349032996746278,0,0,1,0,0,0,0,0,0,0,0,1,0,0,0,0,0,0,0,0,0,0,0,0,0,0,0,0,0,0,0,0,0,0,0,0,0,0,0,0,0,0,0,0,0,0,1,0,0,0,0,0,0,0,0,0,0,0,0,0,1.6063626740230428,1.856176450574687,0.33192858085263244,-1.0085025601740178,0.9148073697079421,0.8051045145784401,3108.6771019310336,432106.11716841365,False,False,1.1571231698280369,0.8642122343368275
85233,85233,sell,apartment,San Telmo,|Argentina|Capital Federal|San Telmo|,Argentina,Capital Federal,3428113.0,,,,1687942.0,ARS,1670334.06,94665.99,43.0,43.0,2201.5346511627913,39254.46511627907,,,,http://www.properati.com.ar/1b2r8_venta_departamento_san-telmo_balcon_piscina_sum_luminoso_amenities_estrenar_situar-propiedades_gi2,"EXCELENTE AMBIENTE A ESTRENAR!! UBICADO EN BARRANCAS DE MADERO, FRENTE A PARQUE LEZAMA, EN EL BARRIO DE SANT TELMO.SUPER LUMINOSO, BAÑO , ESTAR COMEDOR, DORMITORIO, COCINA. BALCÓN SEMICUBIERTOAMENITIES EN 12º PISO PISCINA, SUM Y HERMOSO SOLARIUM UBICADO EN AZOTEA.EXCELENTE ESTRUCTURA E INSTALACIONES.-CONSÚLTENOS!!SITUAR PROPIEDADES Puerto Madero Aimé Painé 1641 SITUAR PROPIEDADES tu lugar...""Sucursal Puerto Madero                    Aimé Painé 1641                               Tel.  +54 11 Sucursal Zona Norte    Dr. Tomas Anchorena 693La Lucila, Vicente Lopez, Pcia. Bs. As.Tel.  + 1870",Monoambiente en San Telmo a estrenar APTO PROFESIONAL,https://thumbs4.properati.com/2/UtARDwTA4_HTdms1TcX6q5Jg85E=/trim/198x0/smart/filters:strip_icc()/tbcn.s3-accelerate.amazonaws.com/pictures/65408768090084106957668380822365163308302764030332268355617544205789790204788.jpg,True,True,,,,,3.0,True,False,False,False,False,False,False,False,False,False,San Telmo,1.3862943611198906,1.9218120556728056,0.0,0.0,False,3.7612001156935624,14.146626310293268,1,0,0,0,0,0,0,0,0,0,0,1,0,0,0,0,0,0,0,0,0,0,0,0,0,0,0,0,0,0,0,0,0,0,0,0,0,0,0,0,0,0,0,0,0,0,0,0,0,0,0,1,0,0,0,0,0,0,0,0,0.29835701951596716,0.1955983781628041,-0.2708778363067856,-1.0085025601740178,-0.6951754572825817,-0.6606960619975789,2395.951480823929,103025.91367542895,False,False,0.9188561073890023,1.0883096841371322
56787,56787,sell,apartment,Nuñez,|Argentina|Capital Federal|Nuñez|,Argentina,Capital Federal,3430348.0,"-34.552129,-58.46838",-34.552129,-58.46838,2618000.0,ARS,2590690.06,146827.06,44.0,44.0,3336.978554097182,59500.0,,1.0,,http://www.properati.com.ar/19rpm_venta_departamento_nunez_balcon_parrilla_piscina_sum_garage_amenities_placard_aire-acondicionado_losa-radiante_subte-linea-d_re-max-total-v,"Corredor Responsable: Jorge Salafia - CUCICBA 5666Contacto: Marta Peña - MLS ID # 420211006-171ULTIMAS  4 UNIDADES!!!!!!!Fideicomiso al costo en pesos. Edificio RONCHAMP II. Entrega Agosto 2018.  Departamento de 1 ambiente al frente, con vista totalmente abierta, orientación norte. Amplio ambiente apaisado, totalmente divisible con aberturas a lo largo,cocina integrada, baño completo, y balcón. Doble placard con interiores. Muy alto nivel de calidad de terminaciones. Edificio con amenities: SUM, solarium, piscina y parrilla. Garita Seguridad. Pisos de madera pulidos y plastificados. Cocina completa,con horno y anafe de acero inoxidable. Losa radiante eléctrica sectorizada. Portero visor. Canalización para aire acondicionado, teléfono y video. Espejo en baño. Hall de acceso al edificio de mármol.Cocheras desde $430.000.- OPCION PRECIO FIJO SIN MAYORES COSTOS POR PAGO ANTICIPADO!!!! (Base marzo 2017) Ubicado a una cuadra de Av. Cabildo 3500 (metrobus), a 6 cuadras de estación Congreso de Tucumán de la linea D de subte y a 7 cuadras de la estación Nuñez del Ferrocarril Mitre.  ",FIDEICOMISO CATEGORIA NUÑEZ- ENTREGA AGOSTO 2018,https://thumbs4.properati.com/7/dHKrSACSoDq4ZFxmAbNxIfSiM3U=/trim/198x0/smart/filters:strip_icc()/remax.com.ar/UserImages/42/L_932b49a3e15a4be2aecca4ffdb09d6f3_iList.jpg,True,True,1.0,1.0,,1.0,1.0,True,False,True,False,True,False,True,True,True,False,Nuñez,0.6931471805599453,0.4804530139182014,0.0,0.0,False,3.784189633918261,14.320091185454423,1,0,1,0,1,0,1,1,1,0,0,1,0,0,0,0,0,0,0,0,0,0,0,0,0,0,0,0,0,0,0,0,0,0,0,1,0,0,0,0,0,0,0,0,0,0,0,0,0,0,0,0,0,0,0,0,0,0,0,0,-1.9376934160154284,-1.6618499419786872,-0.2645986027947083,-1.0085025601740178,-0.6636289171719362,-0.6357740095994395,3321.5165732027435,146146.7292209207,False,False,1.0046550967167174,0.9953664728005357
118565,118565,sell,house,Mataderos,|Argentina|Capital Federal|Mataderos|,Argentina,Capital Federal,3430787.0,,,,350000.0,USD,6175575.0,350000.0,90.0,90.0,3888.888888888889,3888.888888888889,,,,http://www.properati.com.ar/1ceuo_venta_casa_mataderos_terraza_garage_fj-lujan_evj,"Venta lote 130 m2 en barrio Naón, Zelada y fragata Trinidad.Lote en esquina de 26,50 de largo, por Fragata Trinidad. La casa actualmente consta de garage de 3,85 x 9 m. Dormitorio 5,85 x 4,70, comedor de 6 x 3,50 y baño sin terminar 2 x 2 y el principal con yacuzzi.Terraza de la superficie. Hay planos del proyecto. ",Casa - Mataderos,https://thumbs4.properati.com/6/vjKCLpb9RWKzxmZIYp4dhc_ueQE=/trim/198x0/smart/filters:strip_icc()/tbcn.s3-accelerate.amazonaws.com/pictures/104007671616386702454022023537180737385986652358109893093306592497101076517493.jpg,True,True,,,,,3.0,False,False,False,False,False,True,False,False,False,False,Mataderos,1.3862943611198906,1.9218120556728056,0.0,0.0,False,4.499809670330265,20.24828706919777,0,0,0,0,0,1,0,0,0,0,0,0,1,0,0,0,0,0,0,0,0,0,0,0,0,0,0,0,0,0,0,0,0,1,0,0,0,0,0,0,0,0,0,0,0,0,0,0,0,0,0,0,0,0,0,0,0,0,0,0,0.29835701951596716,0.1955983781628041,0.02424613876084618,-1.0085025601740178,0.3183549574792152,0.21594198364603323,1505.219987916955,135469.79891252596,True,False,2.5836016795595755,0.3870565683215027
73864,73864,sell,apartment,Caballito,|Argentina|Capital Federal|Caballito|,Argentina,Capital Federal,3435874.0,"-34.6089514961,-58.4489033124",-34.608951496100005,-58.4489033124,205000.0,USD,3617122.5,205000.0,88.0,75.0,2329.5454545454545,2733.333333333333,,,1.0,http://www.properati.com.ar/1ao89_venta_departamento_caballito_repetto-nicolas-dr-_1100_balcon_suite_gimnasio_lavadero_parrilla_piscina_sum_vestidor_garage_amenities_oslo-propiedades_gf8,"Excelente 3 ambientes de 88m2 en el emprendimiento mas importante de Caballito, AIRES DEL CID. Suite con Vestidor, 2do Baño completo. Cuenta con Cocina Americana. Gran Balcon corrido.AIRES DEL CID es un emprendimiento con un diseño arquitectonico unico en Caballito Norte, Cid Campeador. Contara con amplios amenities: GYM, SKY CLUB, PISCINA, SOLARIUM, PARRILLAS, SUM, LAUNDRY y SEGURIDAD.  COCHERAS FIJAS Y CUBIERTAS.Se entregara con Pisos de calidad en todos sus ambientes, Baño completo con Vanitory y Bañera, Cocina con mesada de grantio, muebles bajo mesada y alacenas, Porcelanato de primera marca, Anafe y Horno electrico Instalado. Todas las griferias son de primera marca.",3 Ambientes de 88m2 en Emprendimiento Premium en Caballito,https://thumbs4.properati.com/2/5_ExqO7SUPXUpZbl_ZJzs9yzKEE=/trim/198x0/smart/filters:strip_icc()/tbcn.s3-accelerate.amazonaws.com/pictures/15894169171876974566790681532038221133925701584039942717043048839983560251806.jpg,True,True,3.0,3.0,,3.0,3.0,True,False,True,False,True,False,False,False,True,False,Caballito,1.3862943611198906,1.9218120556728056,13.0,2.6390573296152584,True,4.477336814478207,20.046544950281856,1,0,1,0,1,0,0,0,1,0,1,1,0,0,0,0,0,0,0,0,0,1,0,0,0,0,0,0,0,0,0,0,0,0,0,0,0,0,0,0,0,0,0,0,0,0,0,0,0,0,0,0,0,0,0,0,0,0,0,0,0.29835701951596716,0.1955983781628041,-0.06994236392031289,0.7912543082420921,0.2875173887399078,0.18695728196586314,2855.351007535133,251270.8886630917,False,False,0.8158525688778357,1.2257116520150815
19347,19347,sell,apartment,Boedo,|Argentina|Capital Federal|Boedo|,Argentina,Capital Federal,3436003.0,"-34.6308072,-58.4178488",-34.63080720000001,-58.4178488,139500.0,USD,2461407.75,139500.0,54.0,50.0,2583.333333333333,2790.0,,,,http://www.properati.com.ar/179kw_venta_departamento_boedo_garage_subte-linea-e_burlini-propiedades,"Departamento a estrenar, al frente, 56m2, excelente ubicación Castro Barros 1526, posee carpintería DVH, cocina-comedor con bajada para lavarropas y pisos de porcelanato, dos dormitorios con placard, instalación para aire acondicionado en living y dormitorio y un baño completo con bañera, El edificio posee un SUM con balcon terraza y parrilla. Se aceptan Permutas por casas, departamentos y lotes en Capital y Provincia.  Aviso publicado por Pixel Inmobiliario (Servicio de Páginas Web para Inmobiliarias).",Ideal departamento de 3 ambientes.,https://thumbs4.properati.com/4/yhAkNNEkBKo41VxkWtPtqLNRn1o=/trim/198x0/smart/filters:strip_icc()/burlinipropiedades.com/photos/3-1-SAM_4271.JPG,True,True,,,3.0,3.0,3.0,False,False,False,False,False,True,False,False,False,False,Boedo,1.3862943611198906,1.9218120556728056,4.0,1.6094379124341003,True,3.9889840465642745,15.911993723744294,0,0,0,0,0,1,0,0,0,0,1,1,0,0,0,0,0,0,0,0,1,0,0,0,0,0,0,0,0,0,0,0,0,0,0,0,0,0,0,0,0,0,0,0,0,0,0,0,0,0,0,0,0,0,0,0,0,0,0,0,0.29835701951596716,0.1955983781628041,-0.22692320172224467,0.08908516734035389,-0.38260714499609816,-0.40706212521862206,1818.6986275068616,98209.72588537053,False,False,1.4204295831435583,0.70401237193814
