89488,89488,sell,apartment,San Telmo,|Argentina|Capital Federal|San Telmo|,Argentina,Capital Federal,3428113.0,"-34.6251347,-58.3789013",-34.625134700000004,-58.378901299999995,70400.0,USD,1242172.8,70400.0,38.0,32.0,1852.6315789473686,2200.0,,,,http://www.properati.com.ar/1b8pr_venta_departamento_san-telmo_balcon_lavadero_terraza_garage_di-mitrio-inmobiliaria_gik,"Bernardo de Irigoyen 1418: Ubicada en pleno corazón de la Ciudad se desarrollara esta torre de 14 Pisos Sobre Privilegiada Ubicacion: Gran Accesibilidad hacia el Centro de la Ciudad! A Pasos del Nuevo Centro de Transbordo que unificará los sistemas de transporte que convergen en la Plaza: Subte Línea ""C"", Metrobus 9 de Julio y el Ferrocarril General Roca. A Metros del Acceso a la Autopista 25 de Mayo, 9 de Julio Sur y Buenos Aires - La Plata. En Pleno Centro Universitario: UAI - Universidad Abierta Interamericana, UADE - Universidad Argentina de la Empresa, UNA - Universidad Nacional de Arte, UCA - Universidad Católica Argentina, UC - Universidad del Cine, UK - Universidad Kennedy y UBA - Facultad de Ingeniería.Bernardo de Irigoyen 1418 contará con 104 Unidades: 102 seran Unidades Monoambientes,  y 2 de ellas, seran 2 Ambientes. Todas las Unidades contaran con Balcones dispuestos al Frente o Contrafrente, algunas de ellas contaran con Terraza Propia. Todas las Unidades serán Externas!El Emprendimiento contara con Cocheras Cubiertas y Descubiertas, Salón de Usos Múltiples con Terraza, Laundry y Servicios Centrales.Una Oportunidad Única para realizar una Inversión desde el Pozo, a Precios Exclusivos!Desarrollo, Proyecto y Dirección de Obra: Diego De Paola I José Maria Perez I Mariana Calcagno - ARQUITECTOSDi Mitrio InmobiliariaAv. Martin Garcia 560 - Carlos Calvo 691 - 20 de Septiembre 314 - ",Departamento - San Telmo,https://thumbs4.properati.com/5/DRDweEEgY2-PSxVaED3vtE0Yyls=/trim/198x0/smart/filters:strip_icc()/tbcn.s3-accelerate.amazonaws.com/pictures/62093441256745041088418639330646406495354497409942068862552798565743353593172.jpg,True,True,,,,,3.0,False,False,False,False,False,True,True,True,True,False,San Telmo,1.3862943611198906,1.9218120556728056,6.0,1.9459101490553132,True,3.6375861597263857,13.232033069432955,0,0,0,0,0,1,1,1,1,0,1,1,0,0,0,0,0,0,0,0,0,0,0,0,0,0,0,0,0,0,0,0,0,0,0,0,0,0,0,0,0,0,0,0,0,0,0,0,0,0,0,1,0,0,0,0,0,0,0,0,0.29835701951596716,0.1955983781628041,-0.33994940493963555,0.31854900357260535,-0.864800265512125,-0.7920975382360894,2244.0522030507223,85273.98371592745,False,False,0.825574189597181,1.2112781777830601
120393,120393,sell,apartment,San Telmo,|Argentina|Capital Federal|San Telmo|,Argentina,Capital Federal,3428113.0,,,,1335800.0,ARS,1321865.41,74916.57,35.0,32.0,2140.473428571429,41743.75,,,,http://www.properati.com.ar/1chvh_venta_departamento_san-telmo_g-d-devlopers,"Departamento 35m², Capital Federal, San Telmo, por $ 1.335.800",Departamento - San Telmo,,True,True,,,,,3.0,False,False,False,False,False,False,False,False,False,False,San Telmo,1.3862943611198906,1.9218120556728056,3.0,1.3862943611198906,True,3.5553480614894135,12.640499838336531,0,0,0,0,0,0,0,0,0,0,1,1,0,0,0,0,0,0,0,0,0,0,0,0,0,0,0,0,0,0,0,0,0,0,0,0,0,0,0,0,0,0,0,0,0,0,0,0,0,0,0,1,0,0,0,0,0,0,0,0,0.29835701951596716,0.1955983781628041,-0.33994940493963555,-0.06309195083504415,-0.9776485400735572,-0.8770843239869779,2287.322619934923,80056.2916977223,False,False,0.9357986538131329,1.068605939883824
48863,48863,sell,apartment,Caballito,|Argentina|Capital Federal|Caballito|,Argentina,Capital Federal,3435874.0,"-34.6223446,-58.4348445",-34.6223446,-58.4348445,97341.0,USD,1717533.27,97341.0,36.0,30.0,2703.9166666666665,3244.7,,1.0,,http://www.properati.com.ar/19ay1_venta_departamento_caballito_balcon_baulera_lavadero_piscina_sum_luminoso_garage_subte-linea-a_subte-linea-e_m-m-propiedades_ean,"Departamento en venta de 1 ambiente en Caballito con proxima entrega.36 m2 totales comodos con balcon amplio, muy luminoso.al contrafrente , orientacion oesteAmenities: Piscina muy amplia con Deck,Solarium, SUM y Laundry.2 Sub suelos de cocheras.Anafe electrico, agua caliente central a gas. Piso ceramico.Consulta por bauleras y cocherasPromedio de expensas 1500Ubicado en lo mejor de Caballito a 3 cuadras del Subte A y cuatro cuadras del Subte E.",Departamento Venta 1 amb en Caballito Proximo a estrenar,https://thumbs4.properati.com/0/MU2mBuVHZE99x-wJlLwKDUbo7Tg=/trim/198x0/smart/filters:strip_icc()/static.sumaprop.com/7600/579881/files/5792010.jpg,True,True,1.0,1.0,1.0,1.0,1.0,True,False,False,False,False,False,False,True,True,False,Caballito,0.6931471805599453,0.4804530139182014,6.0,1.9459101490553132,True,3.58351893845611,12.841607982273604,1,0,0,0,0,0,0,1,1,0,1,1,0,0,0,0,0,0,0,0,0,1,0,0,0,0,0,0,0,0,0,0,0,0,0,0,0,0,0,0,0,0,0,0,0,0,0,0,0,0,0,0,0,0,0,0,0,0,0,0,-1.9376934160154284,-1.6618499419786872,-0.3525078719637901,0.31854900357260535,-0.9389920666539802,-0.8481907067850174,2740.2094211375324,98647.53916095117,False,False,0.9867554814639679,1.0134222903088232
58772,58772,sell,apartment,Recoleta,|Argentina|Capital Federal|Recoleta|,Argentina,Capital Federal,3429595.0,"-34.5898189,-58.3917508",-34.589818900000004,-58.39175079999999,298000.0,USD,5258061.0,298000.0,103.0,103.0,2893.2038834951454,2893.2038834951454,,4.0,,http://www.properati.com.ar/19w8x_venta_departamento_recoleta_balcon_baulera_lavadero_lujoso_dependencias_impecable_subte-linea-h_l-j-ramos_g89,"Impecable piso de 4 ambientes con dependencias de servicio y baulera. Baños y cocina reciclados hace 10 años.Edificio clásico de 10 pisos.Palier privado, amplio living comedor a balcón corrido, hall de distribución a los dormitorios: uno al frente con buenos placares y dos a un aire y luz, ambos con placares. Pisos de parquet.Dos baños, uno completo con bañadera y otro con ducha con mampara de vidrio.La cocina es amplia con muebles bajo mesada y alacenas hechas a medida. Comedor diario integrado a la cocina. Lavadero separado, dependencias de servicio. Baulera.  Servicios centrales.Encargado con vivienda en el edificio. || Gastos - A.B.L.: $1.158 (ABL anual) - Aguas Argentinas: $931 (AySA) - Expensas Comunes: $7.745 (Expensas)",AYACUCHO 1700,https://thumbs4.properati.com/6/9X6qGZvSqpcLd5YCb49RHJxw1E4=/trim/198x0/smart/filters:strip_icc()/static.sumaprop.com/4058/690880/files/7443900.jpg,True,True,4.0,4.0,,4.0,4.0,False,False,False,False,False,False,False,False,False,False,Recoleta,1.6094379124341003,2.5902903939802346,0.0,0.0,False,4.634728988229636,21.480712794336103,0,0,0,0,0,0,0,0,0,0,0,1,0,0,0,0,0,0,0,0,0,0,0,0,0,0,0,0,0,0,0,0,0,0,0,0,0,0,0,0,0,0,0,0,0,0,1,0,0,0,0,0,0,0,0,0,0,0,0,0,1.018204476298646,1.0570519997591272,0.1058761744178507,-1.0085025601740178,0.5034931422907944,0.3930071011240091,3010.173804698836,310047.90188398014,False,False,0.9611418048283118,1.0404292009529534
44269,44269,sell,house,Capital Federal,|Argentina|Capital Federal|,Argentina,Capital Federal,3433955.0,,,,420000.0,USD,7410690.0,420000.0,759.0,257.0,553.3596837944664,1634.2412451361868,,,,http://www.properati.com.ar/1904p_venta_casa_capital-federal_baulera_suite_lavadero_parrilla_piscina_toilette_vestidor_dependencias_garage_estrenar_mieres-corredor-bancalari,"Excelente casa a la venta Talar del Lago IILindÃ­sima casa estilo clÃ¡sico de ladrillo vista, gran living comedor con chimenea, toilette, grandes ventanales. Amplia cocina con comedor diario, muchÃ­simo espacio de guardado, espacio lavavajillas, gran ventanal a la parrilla.Dependencia de servicio con baÃ±o completo y lavadero.PA: tres cmodos dormitorios con placares completos nuevos, sin estrenar; estos tres dormitorios comparten un baÃ±o. Suite principal con gran vista, vestidor y baulera. techos en madera con pendiente a dos aguas.Exterior: Espacio de estacionamiento para 6 autos, uno cubierto con pÃ©rgola en el acceso de servicio y galerÃ­a; tranquera de madera.Galera cubierta con parrilla y barra. pileta con luz y solarium. A/A en todos los dormitorios y en la cocina.Excelentes terminaciones.","Casa 759m² con Dependencias, Argentina, Capital Federal, por U$S 420.000",https://thumbs4.properati.com/5/Ok9R_9o7Aey8VDejq3OcGSRsWLU=/trim/198x0/smart/filters:strip_icc()/sistemadixon.com/get/img_properati.php%3Fc=62901002&n=0&w=800&h=600,True,True,,,,,3.0,True,False,False,False,False,False,False,False,False,False,Capital Federal,1.3862943611198906,1.9218120556728056,502.0,6.220590170099739,True,6.63200177739563,43.9834475753788,1,0,0,0,0,0,0,0,0,0,1,0,1,0,0,0,0,0,0,0,0,0,1,0,0,0,0,0,0,0,0,0,0,0,0,0,0,0,0,0,0,0,0,0,0,0,0,0,0,0,0,0,0,0,0,0,0,0,0,0,0.29835701951596716,0.1955983781628041,1.0728781352777503,3.2337508227302916,3.2441789426410828,3.6260209017194334,901.5021110299938,684240.1022717652,False,False,0.6138196206354259,1.6291431006470602
96760,96760,sell,store,Villa del Parque,|Argentina|Capital Federal|Villa del Parque|,Argentina,Capital Federal,3427455.0,"-34.6145518987,-58.4790478401",-34.6145518987,-58.4790478401,315000.0,USD,5558017.5,315000.0,180.0,180.0,1750.0,1750.0,,,1100.0,http://www.properati.com.ar/1bj5b_venta_local_villa-del-parque_nazca-av-_1700_patio_inmonet_glj,"LOCAL DE 180 MTS CUBIERTOS MAS 45 DESCUBIERTOS EN PATIO TRASERO A PULMON, CON BAÑO Y GAS. PREPARADO PARA OTRO BAÑO. DEBAJO DE EDIFICIO, BAJAS EXPENSAS. ANCHO DE VIDRIERA 5 MTS. POSIBILIDAD DE MARQUESINA SOBRE EL ANCHO DEL EDIFICIO DE 8 MTS. OPCION DE ALQUILER $ 35.000 SIN LLAVE Y 1 MES DE GRACIA. VISITALO YA!!!",Local - Villa del Parque,https://thumbs4.properati.com/8/2DeBo-Bi_QLuBL7H2hGBNP26q54=/trim/198x0/smart/filters:strip_icc()/tbcn.s3-accelerate.amazonaws.com/pictures/88906433619054303718282031518656842796815718178582707132861256821523533969826.jpg,True,True,,,,,3.0,False,False,False,False,False,False,False,False,False,False,Villa del Parque,1.3862943611198906,1.9218120556728056,0.0,0.0,False,5.19295685089021,26.96680085520757,0,0,0,0,0,0,0,0,0,0,0,0,0,1,0,0,0,0,0,0,0,0,0,0,0,0,0,0,0,0,0,0,0,0,0,0,0,0,0,0,0,0,0,0,0,0,0,0,0,0,0,0,0,0,0,0,0,0,0,1,0.29835701951596716,0.1955983781628041,0.5893771548478006,-1.0085025601740178,1.2695012633910585,1.1812045617731628,2177.0888970308906,391876.0014655603,False,False,0.8038256969601225,1.2440507983033662
5683,5683,sell,apartment,Balvanera,|Argentina|Capital Federal|Balvanera|,Argentina,Capital Federal,6693228.0,"-34.604293,-58.4063222",-34.604293,-58.40632220000001,78000.0,USD,1376271.0,78000.0,38.0,38.0,2052.6315789473683,2052.6315789473683,,2.0,,http://www.properati.com.ar/15rgk_venta_departamento_balvanera_placard_subte-linea-b_subte-linea-a_subte-linea-h_victorino-de-la-plaza_d03,"DEPARTAMENTO DE 2 AMBIENTES, 38 M2. APTO PROFESIONAL! PISOS DE PARQUET, COMEDOR, DORMITORIO CON PLACARD, COCINA Y BAÑO COMPLETO.A METROS DE AV. PUEYRREDÓN, PRÓXIMO A SUBTE LÍNEA A Y B, MÚLTIPLES LÍNEAS DE TRANSPORTE Y COMERCIOS.La oferta de este inmueble es sólo a título informativo, pues la venta de la propiedad está supeditada a que el propietario cumplimente el trámite ante la A.F.I.P. para la obtención del Nro. de C.O.T.I. Superficies estimativas.",DEPARTAMENTO 2 AMB. APTO PROFESIONAL | AV. CORRIENTES 2800,https://thumbs4.properati.com/6/mofMgMvd6dlm4U9TLVkaBl6PWXA=/trim/198x0/smart/filters:strip_icc()/static.sumaprop.com/6932/564214/files/5567237.jpg,True,True,,2.0,,2.0,2.0,False,False,False,False,False,False,False,True,False,False,Balvanera,1.0986122886681098,1.206948960812582,0.0,0.0,False,3.6375861597263857,13.232033069432955,0,0,0,0,0,0,0,1,0,0,0,1,0,0,0,1,0,0,0,0,0,0,0,0,0,0,0,0,0,0,0,0,0,0,0,0,0,0,0,0,0,0,0,0,0,0,0,0,0,0,0,0,0,0,0,0,0,0,0,0,-0.6296877615083525,-0.7256302791069891,-0.3022740038671719,-1.0085025601740178,-0.864800265512125,-0.7920975382360894,1971.5426453425307,74918.62052301617,False,False,1.0411296878596048,0.9604951349104637
65437,65437,sell,house,San Telmo,|Argentina|Capital Federal|San Telmo|,Argentina,Capital Federal,3428113.0,"-34.6171480395,-58.369889345",-34.617148039499995,-58.369889345,480000.0,USD,8469360.0,480000.0,320.0,240.0,1500.0,2000.0,,,,http://www.properati.com.ar/1acc3_venta_casa_san-telmo_balcarce_800_baulera_suite_lavadero_patio_sotano_terraza_toilette_vestidor_dependencias_interwin,"Casa histórica totalmente reciclada a nuevo. 5 ambientes + dependencia de servicio, terraza y sótano. Habilitación en trámite para bar cultural.Planta BajaHall de entrada: 3.90 x 1 con piso de mosaico granítico.Recepción: 6 x 5.60 con piso de mosaico granítico y salamandra con tirajeComedor: 7.30 x 3.40 sobre Balcarce, con piso de cemento alisado, tiro balanceado Cocina: 2.60 x 2.50 equipada a fullToilettePatio cubierto: 6 x 2.50 con piso de mosaico graníticoBaulera bajo escaleraSótano: 6.80 x 3.90 con ventilación al exteriorPlanta AltaDormitorio: 4.10 x 3.20 con piso de pinotea y tiro balanceadoPlayroom: 4.40 x 4.30 con piso de parquet y tiro balanceado, balconea al patioSuite: 5.80 x 4.50 con piso de cemento alisadoVestidor: 2.90 x 1.80 con piso de cemento alisadoHall de distribución: 3.70 x 1.60 con piso d cemento alisadoBaño completoHall de distribución: 3 x 1.20 con piso de cemento alisadoTerrazaDependencia de servicioLavadero cubierto: 1.80 x 1.30AVISO LEGAL: Las descripciones arquitectónicas y funcionales, valores de expensas, impuestos y servicios, fotos y medidas de este inmueble son aproximados. Los datos fueron proporcionados por el propietario y pueden no estar actualizados a la hora de la visualización de este aviso por lo cual pueden arrojar inexactitudes y discordancias con las que surgen de los las facturas, títulos y planos legales del inmueble. Los precios indicados podrán modificarse sin previo aviso. La fechas de inicio de obra o posesión son estimadas, podrán ser reprogramadas por la Dirección de obra y dependerán a su vez de un proceso de aprobaciones municipales u otros organismos intervinientes. El interesado deberá realizar las verificaciones respectivas previamente a la realización de cualquier operación, requiriendo por sí o sus profesionales las copias necesarias de la documentación que corresponda. Venta supeditada al cumplimiento por parte del propietario de los requisitos de la resolución general Nº 2371 de la AFIP (pedido de COTI).",Casa en San Telmo,https://thumbs4.properati.com/4/4CJOHCQXX8vUrWEL1S996sUbmn0=/trim/198x0/smart/filters:strip_icc()/tbcn.s3-accelerate.amazonaws.com/pictures/50383416910124725154724623950541714265993316682252062851496303533289221643913.jpg,True,True,5.0,5.0,,5.0,5.0,False,False,False,True,False,True,False,False,False,False,San Telmo,1.791759469228055,3.210401995568401,80.0,4.394449154672439,True,5.768320995793772,33.27352711051525,0,0,0,1,0,1,0,0,0,0,1,0,1,0,0,0,0,0,0,0,0,0,0,0,0,0,0,0,0,0,0,0,0,0,0,0,0,0,0,0,0,0,0,0,0,0,0,0,0,0,0,1,0,0,0,0,0,0,0,0,1.6063626740230428,1.856176450574687,0.9661311655724367,1.9883781669984057,2.0590240318989816,2.08730478551861,925.1755322561444,296056.1703219662,False,False,1.6213139536257315,0.6167836881707629
99552,99552,sell,apartment,Villa del Parque,|Argentina|Capital Federal|Villa del Parque|,Argentina,Capital Federal,3427455.0,,,,191000.0,USD,3370099.5,191000.0,74.0,60.0,2581.081081081081,3183.333333333333,,,,http://www.properati.com.ar/1bms1_venta_departamento_villa-del-parque_balcon_gimnasio_jardin_piscina_vista_amenities_yankel-group,"LAS FRESIAS GARDEN - VILLA DEL PARQUE Hermosa unidad de 3 ambientes con muy buena distribución y metraje en el emprendimiento mas prestigioso del barrio. UNIDADES DE 1,2,3 y 4 ambientes. IDEAL INVERSORES precios excelentes. Único por Naturaleza: Emplazado sobre Remedios de Escalada de San Martín esquina Condarco, en un entorno ideal para disfrutar en familia por su escencia de barrio y su impronta moderna, nace Fresias Garden, un condominio residencial, que contará con un total de 160 unidades de 2, 3 y 4 ambientes distribuidas en Planta Baja y módulos de 6 y 8 pisos, cada una de estas contará con amplios balcones y vistas al parque central de 3.700 m2. El proyecto contará con espacios parquizados y amenities de primer nivel que permitirá combinar el tiempo libre y en familia en un entorno seguro. Único por su estilo: Fresias Garden, ofrecerá al mejor estilo de un barrio cerrado una importante oferta de amenities, entre los que se destaca el área deportiva compuesta por la piscina climatizada,cancha de fútbol y un moderno gimnasio equipado como los más completos fitness center. Además, el complejo contará con social room y un parque central de unos 3700 metros cuadrados. En torno a un gran Parque Central, Fresias Garden, tendrá un total de 160 unidades de 3 y 4 ambientes, distribuidas en Planta Baja y módulos de 6 y 8 pisos, cada una de estas contará con amplios balcones y vistas a los jardines del complejo. Único por su ubicación: Fresias Garden cuenta con una ubicación estratégica, a pocos metros de los centros comerciales de Villa del Parque y Villa Devoto. El proyecto cuenta con varias vías de acceso, rápidas y seguras al centro porteño y al corredor Norte y Oeste del gran Buenos Aires. A su vez, al encontrarse a una cuadra del Metrobus, el desarrollo cuenta con numerosas alternativas de transporte público. Consulte por financiación y formas de pago. Se deja expresa constancia que las medidas, superficies, m2 y proporciones consignadas son aproximados, al igual que las medidas parciales y/o de los ambientes esta sujeto a verificación y/o ajuste. El valor indicado de expensas esta sujeto a variación. El precio del inmueble puede ser modificado sin previo aviso. Fotos de carácter no contractual.",Departamento - Villa del Parque,https://thumbs4.properati.com/4/uIKOJNNUadi1Za-aBOX-_67bKEg=/trim/198x0/smart/filters:strip_icc()/tbcn.s3-accelerate.amazonaws.com/pictures/36885510955754712303508038179024421694723052674294519322835831067974941372509.jpg,True,True,3.0,3.0,,3.0,3.0,True,False,False,False,True,False,True,False,False,False,Villa del Parque,1.3862943611198906,1.9218120556728056,14.0,2.70805020110221,True,4.30406509320417,18.52497632653862,1,0,0,0,1,0,1,0,0,0,1,1,0,0,0,0,0,0,0,0,0,0,0,0,0,0,0,0,0,0,0,0,0,0,0,0,0,0,0,0,0,0,0,0,0,0,0,0,0,0,0,0,0,0,0,0,0,0,0,1,0.29835701951596716,0.1955983781628041,-0.16413086660147194,0.8383053491334598,0.049751496832722016,-0.03164958546515964,2286.992622058786,169237.45403235016,False,False,1.1285917830192,0.8860599687557601
102092,102092,sell,PH,Nuñez,|Argentina|Capital Federal|Nuñez|,Argentina,Capital Federal,3430348.0,"-34.5581493994,-58.4727277743",-34.5581493994,-58.472727774300004,245000.0,USD,4322902.5,245000.0,200.0,200.0,1225.0,1225.0,,,500.0,http://www.properati.com.ar/1bq6r_venta_ph_nunez_prometeo_3100_garage_vivir-propiedades_gnj,"PH DIVISIBLE TIPO LOFT. EXCELENTE OPORTUNIDAD. ANTES ERA COCHERA DE 4 UNIDADES.  DETALLES A COMPLETAR.DICHA PROPIEDAD SE PUEDE VISITAR EN CUALQUIER MOMENTO, por favor indicar en su consulta el día y hora que desea visitarla e indique alguna alternativa.   Esta propiedad  NO ESTÁ CONDICIONADA a la compra de otro inmueble.Tasaciones profesionales.TEL:  WHATSAPP: 1570137959",PH DIVISIBLE TIPO LOFT,https://thumbs4.properati.com/2/xakEfFc3qs3UWjL4g7tSkIdV2o4=/trim/198x0/smart/filters:strip_icc()/tbcn.s3-accelerate.amazonaws.com/pictures/57618495236584836379333287081402217089964825163173131843023886486892938502103.jpg,True,True,,,,,3.0,False,False,False,False,False,False,False,False,True,False,Nuñez,1.3862943611198906,1.9218120556728056,0.0,0.0,False,5.298317366548036,28.072166916664518,0,0,0,0,0,0,0,0,1,0,0,0,0,0,0,0,0,0,0,0,0,0,0,0,0,0,0,0,0,0,0,0,0,0,0,1,0,0,0,0,0,0,0,0,0,0,0,0,0,0,0,0,0,0,0,0,0,0,0,0,0.29835701951596716,0.1955983781628041,0.714961825089346,-1.0085025601740178,1.41407844420849,1.3400147582302946,2594.8253381524055,518965.0676304811,False,True,0.4720934322586187,2.1182247658386983
60384,60384,sell,apartment,Caballito,|Argentina|Capital Federal|Caballito|,Argentina,Capital Federal,3435874.0,"-34.6180489,-58.4604161",-34.6180489,-58.460416099999996,89700.0,USD,1582711.65,89700.0,48.0,43.0,1868.75,2086.046511627907,,,,http://www.properati.com.ar/19z62_venta_departamento_caballito_balcon_luminoso_garage_placard_apto-credito-hipotecario_netprop,"Excelente edificio ubicado a cuadras de Plaza Irlanda.El edificio cuenta con departamentos de un ambiente divisibles ampliamente luminosos con balcón que permiten la máxima entrada de luz durante todo el día, cada unidad posee pisos de porcelanato, y cuentan con alacena, bajo mesada,  placard, y termo-tanque individual.Ideal inversor o primera vivienda.Apto profesional.""ACTUALMENTE CON RENTA HASTA OCTUBRE DE 2017.""Consulte por cocheras cubiertas y semi-cubiertas.Cubiertas: u$s22.000.Semi-cubiertas: u$s18.000.Es apto crédito hipotecario!No pierdas la oportunidad de ver esta propiedad!Se deja constancia que las medidas,  superficies y m2 consignados son aproximados, al igual que las expensas que pueden estar sujetos a verificación y/o ajuste. El precio del inmueble puede ser modificado sin previo aviso, las fotos de carácter no contractual.",Excelente mono-ambiente en la zona del barrio de Caballito.,https://thumbs4.properati.com/7/B3fYqdR7cXQYD8F-758jiefT_Sg=/trim/198x0/smart/filters:strip_icc()/static.sumaprop.com/6336/696200/files/7235039.jpg,True,True,,,,,3.0,False,False,False,False,False,False,False,False,True,False,Caballito,1.3862943611198906,1.9218120556728056,5.0,1.791759469228055,True,3.871201010907891,14.986197266854278,0,0,0,0,0,0,0,0,1,0,1,1,0,0,0,0,0,0,0,0,0,1,0,0,0,0,0,0,0,0,0,0,0,0,0,0,0,0,0,0,0,0,0,0,0,0,0,0,0,0,0,0,0,0,0,0,0,0,0,0,0.29835701951596716,0.1955983781628041,-0.2708778363067856,0.2134229262885749,-0.5442306824000182,-0.5400731903532162,2623.540930336,125929.96465612801,False,False,0.7123006843124292,1.403901501183144
80633,80633,sell,apartment,Balvanera,|Argentina|Capital Federal|Balvanera|,Argentina,Capital Federal,6693228.0,"-34.5971194356,-58.457902253",-34.5971194356,-58.457902253,100000.0,USD,1764450.0,100000.0,72.0,69.0,1388.888888888889,1449.2753623188407,,,3200.0,http://www.properati.com.ar/1ax2p_venta_departamento_balvanera_fragata-pres-sarmiento_2500_lavadero_dependencias_placard_massana-propiedades,"Amplio departamento semipiso de 72 m2 totales en Balvanera. Living comedor de techos altos con pisos de parquet a contrafrente y placard de recepción. Baño y cocina completos. Dormitorio de 4 x 3 m con placard  a contrafrente. Lavadero con baño de servicio. Dependencia de servicio. Puerta blindada. Expensas incluyen AysaInmejorable ubicación  a una cuadra de Av Corrientes con todos los medios de transporte y subte Línea B.¿Necesitás Vender para Comprar?Te ayudamos a encontrar tu próxima propiedadT. WHATSAPP 15- que una Inmobiliaria""Las medidas, superficies y valores de esta ficha son aproximadas y a título informativo únicamente.",Departamento 2 amb de 72 m2 totales en Balvanera,https://thumbs4.properati.com/1/EdUVI4QS6IW7kPC6s7mrUM0e-ts=/trim/198x0/smart/filters:strip_icc()/tbcn.s3-accelerate.amazonaws.com/water_pics/24663262457148974170932343378763255740975152338397377374620073894237385313442.jpg,True,True,,,2.0,2.0,2.0,False,False,False,False,False,False,False,True,False,False,Balvanera,1.0986122886681098,1.206948960812582,3.0,1.3862943611198906,True,4.276666119016055,18.28987309353985,0,0,0,0,0,0,0,1,0,0,1,1,0,0,0,1,0,0,0,0,0,0,0,0,0,0,0,0,0,0,0,0,0,0,0,0,0,0,0,0,0,0,0,0,0,0,0,0,0,0,0,0,0,0,0,0,0,0,0,0,-0.6296877615083525,-0.7256302791069891,-0.10761776499277652,-0.06309195083504415,0.012154239257863238,-0.06542734644601444,1943.115952068785,139904.34854895252,False,False,0.714774065546719,1.399043485489525
71745,71745,sell,house,San Telmo,|Argentina|Capital Federal|San Telmo|,Argentina,Capital Federal,3428113.0,"-34.6148401723,-58.3716816556",-34.6148401723,-58.37168165560001,690000.0,USD,12174705.0,690000.0,441.0,356.0,1564.6258503401361,1938.2022471910113,,,,http://www.properati.com.ar/1ald6_venta_casa_san-telmo_mexico_400_suite_parrilla_terraza_toilette_subte-linea-d_subte-linea-a_subte-linea-e_yes-propiedades-com_gef,"EXCELENTE CASA EN VENTA EN SAN TELMO 400 m2Se trata de una propiedad de dos plantas (y entrepiso), en primer piso por escalera. Muy espaciosa, con gran terraza. Posee ascensor.Ha sido restaurada recientemente, pero respetando su estilo original.PRIMERA PLANTA:Living comedor y biblioteca con livingToilette completoDormitorio con baño en suite marroquíDeposito vestidosENTREPISO: Dos habitacionesPLANTA SUPERIOR:Un penthouse con cocina  Terraza de 50 m2 con parrilla y fuenteDormitorio principal en suite con depósitoCASA EN VENTA EN SAN TELMO CON TERRAZAEntrada exclusivaPRIMER PISO POR ESCALERAEstamos esperando su consulta.Equipo de Yes Propiedades.",Casa - San Telmo,https://thumbs4.properati.com/1/LqOk2H-0sdvLkSi0NKiJTMHxRi8=/trim/198x0/smart/filters:strip_icc()/tbcn.s3-accelerate.amazonaws.com/pictures/85571950174574837050360777683543534768569891135883799962190586220398389313386.jpg,True,True,,,,,3.0,False,False,False,False,False,True,False,False,False,False,San Telmo,1.3862943611198906,1.9218120556728056,85.0,4.454347296253507,True,6.089044875446846,37.0764674952055,0,0,0,0,0,1,0,0,0,0,1,0,1,0,0,0,0,0,0,0,0,0,0,0,0,0,0,0,0,0,0,0,0,0,0,0,0,0,0,0,0,0,0,0,0,0,0,0,0,0,0,1,0,0,0,0,0,0,0,0,0.29835701951596716,0.1955983781628041,1.6945222529734003,2.029226878584222,2.499125848519375,2.6336809867305204,1035.9025828901777,456833.03905456833,False,False,1.5103986380406695,0.6620768681950265
