48843,48843,sell,apartment,San Telmo,|Argentina|Capital Federal|San Telmo|,Argentina,Capital Federal,3428113.0,"-34.6169105336,-58.373245046",-34.6169105336,-58.373245046,157000.0,USD,2770186.5,157000.0,58.0,52.0,2706.8965517241377,3019.230769230769,,3.0,,http://www.properati.com.ar/19awz_venta_departamento_san-telmo_balcon_baulera_gimnasio_lavadero_piscina_luminoso_garage_amenities_subte-linea-e_subte-linea-c_m-m-propiedades_eq1,"Descripción General: Ubicado a metros del Corazón de San Telmo, (a 300 metros de la Plaza Dorrego), y a solo minutos, caminando,  del microcentro y principales universidades de la zona, el edificio Alto Grande Independencia es el espacio ideal para estar cerca de todo. Su moderno diseño cuenta con servicios y amenities de primer nivel para disfrutar de estar en casa. Sus 8 niveles de departamentos con un lay-out de circulación muy eficiente, están combinadas con una planta baja de locales comerciales y subsuelos de cocheras.Características:Inmejorable ubicación a metros del corazón de San Telmo, Microcentro y principales universidades de la zona, además de gran cantidad de medios de transporte a todos los puntos de la capital e interior del país..  Piscina,  y un muy amplio Solárium con sol todo el día, ubicado en una plataforma elevada en lo más alto del edificio con atractivas vistas a la ciudad.•  Servicio de conserjería: recepción de correo, distribución y entrega de revistas y diarios, pedidos de supermercado, y otros servicios útiles.•  Departamentos eficientes, bien diseñados, desde Estudios (mono ambientes) a 2 y 3 ambientes, con balcones. Ingreso a amplio lobby cómodo y funcional, flanqueado por un luminoso deck, con un fácil acceso a los ascensores y escaleras.•  Gimnasio, Vestuarios, Laundry..  Estacionamiento en subsuelos, con infladores de neumáticos, servicio de lavado de autos, muy  fácil circulación.  Bauleras.•  Seguridad las 24hs, con sistema de monitoreo y control de accesos.",Nuevo Edificio en San Telmo,https://thumbs4.properati.com/9/9kmXl9yClhOAgjivNHTI6Qp6rr4=/trim/198x0/smart/filters:strip_icc()/static.sumaprop.com/7600/566086/files/5590574.jpg,True,True,3.0,3.0,,3.0,3.0,True,False,True,False,True,False,False,False,True,False,San Telmo,1.3862943611198906,1.9218120556728056,6.0,1.9459101490553132,True,4.060443010546419,16.48719744189527,1,0,1,0,1,0,0,0,1,0,1,1,0,0,0,0,0,0,0,0,0,0,0,0,0,0,0,0,0,0,0,0,0,0,0,0,0,0,0,0,0,0,0,0,0,0,0,0,0,0,0,1,0,0,0,0,0,0,0,0,0.29835701951596716,0.1955983781628041,-0.21436473469809011,0.31854900357260535,-0.284550149999743,-0.32442143389684774,2805.288006454087,162706.70437433705,False,False,0.9649264337552574,1.0363484355053316
23916,23916,sell,house,Capital Federal,|Argentina|Capital Federal|,Argentina,Capital Federal,3433955.0,,,,850000.0,USD,14997825.0,850000.0,900.0,400.0,944.4444444444445,2125.0,,,,http://www.properati.com.ar/17mw4_venta_casa_bs-as-g-b-a-zona-norte_suite_hidromasaje_lavadero_parrilla_piscina_toilette_vestidor_dependencias_impecable_aire-acondicionado_gimenez-uriburu-propiedades-hector-gimenez-uriburu-csi-4904,"Espectacular casa sobre lote interno estilo reacionalista de pocos aÃ±os de antiguedad. IMPECABLE!!!!! Espacios muy amplios. Materiales nobles, y muy cÃ³modaEntrada para varios autosPB: Lugar de estar, toilette, living con chimenea y aire acondicionado y comedor separados ( ambos con grandes ventanales al jardÃ­n), enorme cocina con comedor diario, lavadero, dependencia con baÃ±o.PA: Gran family con aire A/A, Cuarto ppal. en suite con A/A y baÃ±o con jacuzzi, buen vestidor, balcÃ³n al jardÃ­n. Tiene 4 habitaciones mÃ¡s con 2 baÃ±os completos, dos dÃ¡n al jardÃ­n. Exterior: GalerÃ­a con parrilla, pileta bien grande, muy buen tamaÃ±o de jardÃ­n.","Casa 900m² con 2 Plantas, Argentina, Capital Federal, por U$S 850.000",https://thumbs4.properati.com/8/CI5M5cq1lEVYojdDs3kIcBsAQBc=/trim/198x0/smart/filters:strip_icc()/sistemadixon.com/get/img_properati.php%3Fc=67900951&n=0&w=800&h=600,True,True,4.0,4.0,,4.0,4.0,True,False,False,False,False,False,False,False,False,False,Capital Federal,1.6094379124341003,2.5902903939802346,500.0,6.2166061010848646,True,6.802394763324311,46.27257451610201,1,0,0,0,0,0,0,0,0,0,1,0,1,0,0,0,0,0,0,0,0,0,1,0,0,0,0,0,0,0,0,0,0,0,0,0,0,0,0,0,0,0,0,0,0,0,0,0,0,0,0,0,0,0,0,0,0,0,0,0,1.018204476298646,1.0570519997591272,1.9708085275048002,3.231033808782432,3.4779945934360974,3.9549044379955522,878.0249095520799,790222.4185968719,False,False,1.0756465268465427,0.9296734336433786
117038,117038,sell,apartment,Flores,|Argentina|Capital Federal|Flores|,Argentina,Capital Federal,3433918.0,"-34.629765,-58.465304",-34.629765,-58.465304,195000.0,USD,3440677.5,195000.0,108.0,100.0,1805.555555555556,1950.0,,,2600.0,http://www.properati.com.ar/1cd1q_venta_departamento_flores_balcon_lavadero_toilette_dependencias_garage_placard_doble-circulacion_subte-linea-a_apto-credito-hipotecario_luye-propiedades,"CODIGO: 1066-luye7 ubicado en: Av. Rivadavia al 7100 -  Publicado por: LUYE PROPIEDADES. El precio es de USD 195000 null. Depto. de 4 ambientes al contrafrente con balcón corrido. Hall de recepción. Living y comedor, con muebles empotrados de madera a medida. Muy buen gusto. Pisos de parket en recepción y dormitorios. Persianas de madera. 2 Dormitorios con placard. 1 con salida al balcón. Baño completo y toilet de época en muy buen estado. Split frio/calor en dormitorio y living. Estufas de tiro balanceado. Entrada de Servicio. Doble circulación. Dependencia. Baño con ducha. Cocina comedor, lavadero independiente. Edificio antiguo en muy buen estado y construcción. Cochera fija cubierta. Apto crédito hipotecario. La ubicación es excelente. En el edificio su ubicación propicia el silencio y las vistas. En la zona, inmediato a subte A, proximamente metrobus sobre Av. Rivadavia e innumerables vinculaciones con la ciudad y el conurbano. Para ver más fotos, por favor, ingresar a  . Publicado a través de Mapaprop",4 Amb. c/Depend.Ent.Serv.Doble Circ.Contrafrente. Cochera. Muy buena prop. y Ubicación.Apto Crédito.,https://thumbs4.properati.com/9/s-W9q1lUgAsOJF0wuY9sAib0uf0=/trim/198x0/smart/filters:strip_icc()/images.mapapropapp.com/mapaprop-images/photos/1066/134602/1211839.jpg,True,True,4.0,4.0,,4.0,4.0,False,False,False,False,False,False,True,True,True,False,Flores,1.6094379124341003,2.5902903939802346,8.0,2.1972245773362196,True,4.68213122712422,21.922352828011753,0,0,0,0,0,0,1,1,1,0,1,1,0,0,0,0,0,0,0,0,0,0,0,0,0,0,0,0,0,1,0,0,0,0,0,0,0,0,0,0,0,0,0,0,0,0,0,0,0,0,0,0,0,0,0,0,0,0,0,0,1.018204476298646,1.0570519997591272,0.0870384738816189,0.48993780341219406,0.5685391609157452,0.45645842549244414,1932.850844565401,208747.89121306333,False,False,0.9341411731961826,1.0705020062208372
36788,36788,sell,house,Parque Patricios,|Argentina|Capital Federal|Parque Patricios|,Argentina,Capital Federal,3430114.0,"-34.6386156225,-58.4135727883",-34.6386156225,-58.4135727883,300000.0,USD,5293350.0,300000.0,200.0,120.0,1500.0,2500.0,,,,http://www.properati.com.ar/18hqq_venta_casa_parque-patricios_luminoso_lujoso_garage_subte-linea-h_ph-urbano,"OPORTUNIDAD, NO SE LO PIERDA, PROPIEDAD EN PRIMER PISO , MUY CONFORTABLE. LUMINOSA, POSEE DETALLES DE CATEGORIA. MODERNA Y CON GARAGE Y UBICADA EN LA MEJOR ZONA DE PARQUE PATRICIOS,. COCINA INTEGRADA INSTALADA MUY NODERNA.ESCUCHAMOS OFERTAS. NO SE LO PIERDA. SU CONSULTA NO MOLESTA.GRACIAS.  FRANCA. DE PHURBANO. 1561615555. Aviso publicado por Pixel Inmobiliario (Servicio de Páginas Web para Inmobiliarias).","excelente propiadad en polo tecnologico, sobre la av. caseros. ph en 1 piso. sin expensas,.",https://thumbs4.properati.com/5/4gDBCNFKsAGIg8xtY_sBGr_n0nA=/trim/198x0/smart/filters:strip_icc()/phurbano.com/photos/0009-1457385929_14573859292680a935ceb5db814c0ad175d988ed54.JPG,True,True,,,,,3.0,False,False,False,False,False,False,False,False,False,False,Parque Patricios,1.3862943611198906,1.9218120556728056,80.0,4.394449154672439,True,5.298317366548036,28.072166916664518,0,0,0,0,0,0,0,0,0,0,1,0,1,0,0,0,0,0,0,0,0,0,0,0,0,0,0,0,0,0,0,0,0,0,0,0,0,0,0,0,0,0,0,1,0,0,0,0,0,0,0,0,0,0,0,0,0,0,0,0,0.29835701951596716,0.1955983781628041,0.21262314412316433,1.9883781669984057,1.41407844420849,1.3400147582302946,1077.048726371892,215409.7452743784,False,False,1.392694650921548,0.718032484247928
92660,92660,sell,apartment,Caballito,|Argentina|Capital Federal|Caballito|,Argentina,Capital Federal,3435874.0,"-34.6273106938,-58.4296005699",-34.6273106938,-58.429600569899996,403639.0,USD,7122008.33,403639.0,124.0,98.0,3255.153225806452,4118.765306122449,,,,http://www.properati.com.ar/1bd4g_venta_departamento_caballito_doblas_900_garage_subte-linea-e_soldati-propiedades_gjr,"Situado en un único lote de más de 3.900 m2 de terreno, Palmera Caballito es una torre de 24 pisos dividida en 4 módulos independientes con unidades desde 29 m2 de 1, 2, 3 y 4 ambientes.Con una ubicación estratégica: a 200mts de estación de Subte Linea E, Av. La Plata, Av. Pedro Goyena y Av. Jose Maria Moreno.La unidad publicada es la 23º49.CUCICBA Mat. 1544",Departamento de dos dormitorios en Caballito,https://thumbs4.properati.com/9/4uTOTNK8IQTBk0dw0k_jwhxADu0=/trim/198x0/smart/filters:strip_icc()/tbcn.s3-accelerate.amazonaws.com/pictures/34442844302975468446742061465172866604246603556969090803190726527558658878280.jpg,True,True,4.0,4.0,,4.0,4.0,False,False,False,False,False,False,False,True,False,False,Caballito,1.6094379124341003,2.5902903939802346,26.0,3.295836866004329,True,4.820281565605037,23.23511437171175,0,0,0,0,0,0,0,1,0,0,1,1,0,0,0,0,0,0,0,0,0,1,0,0,0,0,0,0,0,0,0,0,0,0,0,0,0,0,0,0,0,0,0,0,0,0,0,0,0,0,0,0,0,0,0,0,0,0,0,0,1.018204476298646,1.0570519997591272,0.07448000685746435,1.2391579852052999,0.7581109975931304,0.6450655538690592,1943.1446661431632,240949.93860175225,True,False,1.675198600764718,0.5969441471259026
7533,7533,sell,apartment,San Telmo,|Argentina|Capital Federal|San Telmo|,Argentina,Capital Federal,3428113.0,"-34.6175845,-58.3771975",-34.6175845,-58.3771975,192793.0,USD,3401736.08,192793.0,80.0,80.0,2409.9125,2409.9125,,1.0,,http://www.properati.com.ar/15y6d_venta_departamento_san-telmo_balcon_baulera_gimnasio_lavadero_piscina_terraza_luminoso_garage_amenities_subte-linea-e_subte-linea-c_grupo-galactica,Pozo • Entrega 31/10/2018Ubicado a metros del Corazón de San Telmo (a 300 metros de la Plaza Dorrego) y a solo minutos caminando del microcentro y principales universidades de la zona el edificio Alto Grande Independencia es el espacio ideal para estar cerca de todo. Su moderno diseño cuenta con servicios y amenities de primer nivel para disfrutar de estar en casa. Sus 8 niveles de departamentos con un lay-out de circulación muy eficiente están combinadas con una planta baja de locales comerciales y subsuelos de cocheras.Dos ambientes Doble DuplexBalcon Terraza: 353 m2> Características:Inmejorable ubicación a metros del corazón de San Telmo Microcentro y principales universidades de la zona además de gran cantidad de medios de transporte a todos los puntos de la capital e interior del país.• Piscina y un muy amplio Solárium con sol todo el día ubicado en una plataforma elevada en lo más alto del edificio con atractivas vistas a la ciudad.• Servicio de conserjería: recepción de correo distribución y entrega de revistas y diarios pedidos de supermercado y otros servicios útiles.• Departamentos eficientes bien diseñados 2 ambientes con balcones. Ingreso a amplio lobby cómodo y funcional flanqueado por un luminoso deck con un fácil acceso a los ascensores y escaleras.• Gimnasio Vestuarios Laundry.• Estacionamiento en subsuelos con infladores de neumáticos servicio de lavado de autos muy fácil circulación. Bauleras.• Seguridad las 24hs con sistema de monitoreo y control de accesos.,Edificio Moderno a Estrenar - 2 ambientes,"https://thumbs4.properati.com/3/qif4K_XLBQwEyDkLvOL_cvA-VN0=/trim/198x0/smart/filters:strip_icc()/maps.googleapis.com/maps/api/staticmap%3Fkey=AIzaSyCtB7aox9MJ3hCrd_u4KJ5N0v8syKusnaA&center=-34.6175845,-58.3771975&zoom=19&size=800x600&maptype=satellite&sensor=false",True,True,2.0,1.0,2.0,1.0,1.0,True,False,True,False,True,True,False,False,True,False,San Telmo,0.6931471805599453,0.4804530139182014,0.0,0.0,False,4.382026634673881,19.202157426991302,1,0,1,0,1,1,0,0,1,0,0,1,0,0,0,0,0,0,0,0,0,0,0,0,0,0,0,0,0,0,0,0,0,0,0,0,0,0,0,0,0,0,0,0,0,0,0,0,0,0,0,1,0,0,0,0,0,0,0,0,-1.9376934160154284,-1.6618499419786872,-0.03854619635992653,-1.0085025601740178,0.1567314200752947,0.06564240435602026,2568.575279583544,205486.02236668352,False,False,0.9382292663000054,1.0658375686185886
105985,105985,sell,apartment,Palermo Hollywood,|Argentina|Capital Federal|Palermo|Palermo Hollywood|,Argentina,Capital Federal,,"-34.5805094287,-58.4318511211",-34.5805094287,-58.431851121099996,145500.0,USD,2567274.75,145500.0,31.0,27.0,4693.548387096775,5388.88888888889,,,,http://www.properati.com.ar/1bvil_venta_departamento_palermo-hollywood_guatemala_5600_gimnasio_lavadero_parrilla_piscina_quincho_electrogeno_garage_subte-linea-d_roig-parasol-propiedades,"            Es un frente de 5 lotes sobre Guatemala entre Fitz Roy y Bonpland Unidades de 1, 2 y 3 ambientes. Todas las unidades de dos y tres ambientes disponen de una cochera pre asignada. Memoria descriptiva Hall de Acceso con revestimientos de mármol o granito.Garita de seguridad con personal de vigilancia las 24 hs. Cocheras cubiertas fijas 3 Ascensores automáticos de última generación Laundry equipado Grupo electrógeno para áreas comunesCCTV con grabación digital En 10º Piso Piscina de 24 mts . Quincho con parrilla Gimnasio equipado con maquinas de última generación. Posibilidades de financiación.        ",Departamento - Palermo Hollywood,https://thumbs4.properati.com/1/qhA7HMKHJFLYedr3h4P-dSMASew=/trim/198x0/smart/filters:strip_icc()/tbcn.s3-accelerate.amazonaws.com/pictures/113307078750996977450064556988079129079646126256505112664883294352177878756992.jpg,True,True,3.0,3.0,,3.0,3.0,True,False,True,False,False,False,False,False,True,False,Palermo Hollywood,1.3862943611198906,1.9218120556728056,4.0,1.6094379124341003,True,3.4339872044851463,11.79226812056771,1,0,1,0,0,0,0,0,1,0,1,1,0,0,0,0,0,0,0,0,0,0,0,0,0,0,0,0,0,0,0,0,0,0,0,0,0,0,0,0,1,0,0,0,0,0,0,0,0,0,0,0,0,0,0,0,0,0,0,0,0.29835701951596716,0.1955983781628041,-0.3713455725000219,0.08908516734035389,-1.1441816142305563,-0.9989515048577952,3683.1283492360135,114176.97882631642,False,False,1.2743374495950843,0.7847215039609375
26265,26265,sell,apartment,Belgrano,|Argentina|Capital Federal|Belgrano|,Argentina,Capital Federal,3436077.0,"-34.5492113,-58.4664545",-34.549211299999996,-58.46645450000001,79900.0,USD,1409795.55,79900.0,35.0,35.0,2282.857142857143,2282.857142857143,,2.0,,http://www.properati.com.ar/17qx0_venta_departamento_belgrano_luminoso_placard_subte-linea-d_ricardo-fernandez-asesoria-inmobiliaria_fea,"Excelente departamento de dos ambientes en barrio de NezLiving comedor - Dormitorio con placardCocina completa con mueble bajo mesada y alacenas nuevas Bao completo con mamparaVista abierta y sper luminosoNo accesible discapacitadosLa mejor ubicacin de Nez: a una cuadra de Avenido Cabildo y Metrobus, media cuadra de Avenida Crislogo Larralde, cuatro cuadras de Estacin Nez FFCC MitreCon renta hasta marzo de 2017, excelentes inquilinos.Valor: U$S 79.900,- .Publicado por Ricardo Fernandez Asesoria Inmobiliaria a traves INMOMAP",VENDIDO  -NEZ 2 AMBIENTES CON RENTA EN LA MEJOR UBICACIN,https://thumbs4.properati.com/0/z1QoRkp-QxRE0CGhaFQwDKMP5E8=/trim/198x0/smart/filters:strip_icc()/www.inmomap.com.ar/fotos/1468682989_146868298963c85d8fea3a65f4a0888e30607c53a7.JPG,True,True,,2.0,,2.0,2.0,False,False,False,False,False,False,True,False,False,False,Belgrano,1.0986122886681098,1.206948960812582,0.0,0.0,False,3.5553480614894135,12.640499838336531,0,0,0,0,0,0,1,0,0,0,0,1,0,0,0,0,0,0,1,0,0,0,0,0,0,0,0,0,0,0,0,0,0,0,0,0,0,0,0,0,0,0,0,0,0,0,0,0,0,0,0,0,0,0,0,0,0,0,0,0,-0.6296877615083525,-0.7256302791069891,-0.32111170440340375,-1.0085025601740178,-0.9776485400735572,-0.8770843239869779,2851.1855042175994,99791.49264761597,False,False,0.8006694546813037,1.2489548516597744
48047,48047,sell,apartment,San Telmo,|Argentina|Capital Federal|San Telmo|,Argentina,Capital Federal,3428113.0,"-34.6211839,-58.3731163",-34.6211839,-58.37311629999999,1367300.0,ARS,1353036.89,76683.21,35.0,31.0,2190.9488571428574,44106.451612903234,,1.0,,http://www.properati.com.ar/199i5_venta_departamento_san-telmo_garage_subte-linea-c_nucifora-propiedades_cro,"Edificio en construcción En una de las avenidas más emblemáticas de Buenos Aires, se desarrolla esta torre de 13 pisos, con departamentos aptos para trabajo, bajo el concepto work & living. Consiste en 95 monoambientes en San Telmo con superficies de 30 a 36 m2. Además, el proyecto cuenta con 44 amplias cocheras y un local comercial en planta baja.ENTREGA DICIEMBRE 2019",Ubicado sobre una de las avenidas más emblemáticas de Buenos Aires. Excelentes unidades de negocios ,https://thumbs4.properati.com/3/HozayxmwUTTty7EsopCJrJWrvv4=/trim/198x0/smart/filters:strip_icc()/static.sumaprop.com/189/322720/files/6801620.jpg,True,True,,1.0,,1.0,1.0,False,False,False,False,False,False,False,False,True,False,San Telmo,0.6931471805599453,0.4804530139182014,4.0,1.6094379124341003,True,3.5553480614894135,12.640499838336531,0,0,0,0,0,0,0,0,1,0,1,1,0,0,0,0,0,0,0,0,0,0,0,0,0,0,0,0,0,0,0,0,0,0,0,0,0,0,0,0,0,0,0,0,0,0,0,0,0,0,0,1,0,0,0,0,0,0,0,0,-1.9376934160154284,-1.6618499419786872,-0.3462286384517128,0.08908516734035389,-0.9776485400735572,-0.8770843239869779,2356.6181344125343,82481.63470443871,False,False,0.9297004148230509,1.0756153101107622
10045,10045,sell,apartment,Villa Crespo,|Argentina|Capital Federal|Villa Crespo|,Argentina,Capital Federal,3427458.0,"-34.595822,-58.438988",-34.595822,-58.438988,75000.0,USD,1323337.5,75000.0,26.0,26.0,2884.615384615385,2884.615384615385,,1.0,,http://www.properati.com.ar/166b2_venta_departamento_villa-crespo_luminoso_subte-linea-b_migliorisi-propiedades_cy0,"Edificio ubicado en esquina cuya unidades dan al frente  . Super luminoso . La unidades son apto profesional y comercial . A pasos de AV Corrientes , proximo al barrio de Palermo",Departamento de 1 ambiente en Venta en Villa crespo,https://thumbs4.properati.com/4/TmyRZhgreEkbMx99Z28XJGs0RgI=/trim/198x0/smart/filters:strip_icc()/static.sumaprop.com/2171/572732/files/5678166.jpg,True,True,,1.0,1.0,1.0,1.0,False,False,False,False,False,False,False,False,False,False,Villa Crespo,0.6931471805599453,0.4804530139182014,0.0,0.0,False,3.258096538021482,10.615193051067568,0,0,0,0,0,0,0,0,0,0,0,1,0,0,0,0,0,0,0,0,0,0,0,0,0,0,0,0,0,0,0,0,0,0,0,0,0,0,0,0,0,0,0,0,0,0,0,0,0,0,0,0,0,1,0,0,0,0,0,0,-1.9376934160154284,-1.6618499419786872,-0.3776248060120992,-1.0085025601740178,-1.3855412595459107,-1.1680642807518924,2465.21087842495,64095.482839048695,False,False,1.1701292615009056,0.8546064378539825
47407,47407,sell,apartment,Belgrano,|Argentina|Capital Federal|Belgrano|,Argentina,Capital Federal,3436077.0,"-34.5610457,-58.4494072",-34.56104570000001,-58.4494072,440000.0,USD,7763580.0,440000.0,110.0,100.0,4000.0,4400.0,,4.0,,http://www.properati.com.ar/1988i_venta_departamento_belgrano_balcon_baulera_suite_gimnasio_hidromasaje_lavadero_parrilla_piscina_sum_toilette_sauna_dependencias_garage_placard_subte-linea-d_franca-propiedades_eqx,"Semipiso de 4 ambientes con dependencia de servicio, al frente. 3º piso. Superficie total de 110m², cubierta 100m² y descubierta de 10m². 3 dormitorios con placard, 3 baños (uno en suite, uno completo y un toilette). Balcón con parrilla propia, cocina a gas, living-comedor, dependencia de servicio, lavadero. 3 aires ac. Baulera. Pisos de madera. Una cochera cubierta fija. Expensas $8.500 (junio 2017). Antigüedad 6 años. Edificio de 6 pisos, 40 departamentos en total. Vigilancia 24hs. Piscina en PB, solárium, SUM, Gym, sector de juegos para chicos, laundry, sector de spa (masajes, sauna, jacuzzi). Colectivos: 15, 29, 42, 107, 114, 130.Venta sujeta a la obtención del COTI por parte del propietario.Las reservas se toman exclusivamente en la inmobiliaria con el matriculado - Matricula CPI 6099.",11 de Septiembre 2500 Belgrano 4amb U$440.000 c/amenities y coch,https://thumbs4.properati.com/4/L76JDVL2VplwJq4qGmuWX7-ebxI=/trim/198x0/smart/filters:strip_icc()/static.sumaprop.com/7641/662542/files/6745176.jpg,True,True,4.0,4.0,,4.0,4.0,True,False,False,False,False,False,False,False,True,False,Belgrano,1.6094379124341003,2.5902903939802346,10.0,2.3978952727983707,True,4.700480365792417,22.09451566920001,1,0,0,0,0,0,0,0,1,0,1,1,0,0,0,0,0,0,1,0,0,0,0,0,0,0,0,0,0,0,0,0,0,0,0,0,0,0,0,0,0,0,0,0,0,0,0,0,0,0,0,0,0,0,0,0,0,0,0,0,1.018204476298646,1.0570519997591272,0.0870384738816189,0.6267891170971819,0.5937181069612597,0.4811934120141829,3188.355336384353,350719.08700227883,False,False,1.2545653096922582,0.7970888340960882
66077,66077,sell,apartment,Palermo,|Argentina|Capital Federal|Palermo|,Argentina,Capital Federal,3430234.0,,,,125000.0,USD,2205562.5,125000.0,48.0,40.0,2604.1666666666665,3125.0,,,2000.0,http://www.properati.com.ar/1adbg_venta_departamento_palermo_jardin_lavadero_patio_placard_filippo-propiedades_gd8,"EXCELENTE DEPARTAMENTO DE 2 AMBIENTES CON PATIO EN INMEJORABLE ZONA, A PASOS DE PARQUE LAS HERAS, JARDIN BOTANICO, AVENIDAS CON TODOS LOS TRANSPORTES. AMPLIO LIVING-COMEDOR CON PISOS DE PARQUET Y GRAN VENTANAL CON SALIDA AL PATIO.  LINDA COCINA CON MESADA DE MARMOL,  MUEBLES Y LAVADERO INCORPORADO.  AMPLIO DORMITORIO CON PLACARD DE PISO A TECHO Y DE PARED A PARED. BAÑO COMPLETO.VENTA: U$S 125.000.-FILIPPO PROPIEDADES - ",EXCELENTE 2 AMBIENTES CON PATIO EN ESPECTACULAR ZONA!!!,https://thumbs4.properati.com/4/VHCH9MI_9RBNi394WtGxKQpfXjw=/trim/198x0/smart/filters:strip_icc()/tbcn.s3-accelerate.amazonaws.com/pictures/6747501955985386843797185562518135845422665658034073334720708880363706799718.jpg,True,True,,,,,3.0,False,False,False,False,False,False,False,False,False,False,Palermo,1.3862943611198906,1.9218120556728056,8.0,2.1972245773362196,True,3.871201010907891,14.986197266854278,0,0,0,0,0,0,0,0,0,0,1,1,0,0,0,0,0,0,0,0,0,0,0,0,0,0,0,0,0,0,0,0,0,0,0,0,0,0,1,0,0,0,0,0,0,0,0,0,0,0,0,0,0,0,0,0,0,0,0,0,0.29835701951596716,0.1955983781628041,-0.2897155368430174,0.48993780341219406,-0.5442306824000182,-0.5400731903532162,2941.9548841425285,141213.83443884138,False,False,0.8851823937557374,1.129710675510731
96638,96638,sell,apartment,Palermo Hollywood,|Argentina|Capital Federal|Palermo|Palermo Hollywood|,Argentina,Capital Federal,,,,,107000.0,USD,1887961.5,107000.0,41.0,37.0,2609.756097560976,2891.891891891892,,,,http://www.properati.com.ar/1biz8_venta_departamento_palermo-hollywood_la-comunidad-inmobiliaria,"Emprendimiento inmobiliario en Palermo Hollywood con 8 pisos de unidades monoambientes y 2 unidades de 2 ambientes con jardín en PB. Plantas flexibles, cada piso cuenta con 4 unidades y en el ultimo piso se encuentran situados los Amenities: SUM, Piscina y Solárium.",Departamento - Palermo Hollywood,https://thumbs4.properati.com/0/1kxPoAqFtiD5Qmz-3Rzwvx3ouvE=/trim/198x0/smart/filters:strip_icc()/tbcn.s3-accelerate.amazonaws.com/pictures/23188033413345681656897949543418043188363990810618814190242106512861836232329.jpg,True,True,2.0,2.0,,2.0,2.0,True,False,False,False,True,False,False,False,False,False,Palermo Hollywood,1.0986122886681098,1.206948960812582,4.0,1.6094379124341003,True,3.713572066704308,13.790617494606504,1,0,0,0,1,0,0,0,0,0,1,1,0,0,0,0,0,0,0,0,0,0,0,0,0,0,0,0,0,0,0,0,0,0,0,0,0,0,0,0,1,0,0,0,0,0,0,0,0,0,0,0,0,0,0,0,0,0,0,0,-0.6296877615083525,-0.7256302791069891,-0.30855323737924917,0.08908516734035389,-0.7605313356940352,-0.7118445746316333,3279.395307338128,134455.20760086324,False,False,0.7958040592792408,1.2565907252417126
55060,55060,sell,apartment,Belgrano,|Argentina|Capital Federal|Belgrano|,Argentina,Capital Federal,3436077.0,"-34.5554216604,-58.438384981",-34.5554216604,-58.438384981000006,230000.0,USD,4058235.0,230000.0,78.0,77.0,2948.717948717949,2987.012987012987,,3.0,,http://www.properati.com.ar/19odj_venta_departamento_belgrano_bienvende-amelia-claro_e77,"DEPARTAMENTO DE 78 METROS TOTALES. Dos dormitorios muy amplios, living comedor, cocina y un baño. Placares en todos los ambientes (inclusive en hall y pasillo).  Termotanque, inodoro, bidet y grifaría de baño nuevos.Aire F/C Samsung de 4500F, tiro balanceado nuevo-APTO CREDITOEXPENSAS $2.00040 AÑOS DE ANTIGUEDADBIENVENDE AMELIA CLAROAv. Federico Lacroze 23554778-",DEPARTAMENTO DE 3 AMBIENTES CON BALCÓN  AL FRENTE ,https://thumbs4.properati.com/6/rAqg3aT6Fitcl_9YQ7IMdP5Jmus=/trim/198x0/smart/filters:strip_icc()/static.sumaprop.com/8037/678206/files/6929391.jpg,True,True,,3.0,,3.0,3.0,False,False,False,False,False,False,False,False,False,False,Belgrano,1.3862943611198906,1.9218120556728056,1.0,0.6931471805599453,True,4.356708826689592,18.980911800555,0,0,0,0,0,0,0,0,0,0,1,1,0,0,0,0,0,0,1,0,0,0,0,0,0,0,0,0,0,0,0,0,0,0,0,0,0,0,0,0,0,0,0,0,0,0,0,0,0,0,0,0,0,0,0,0,0,0,0,0,0.29835701951596716,0.1955983781628041,-0.057383896896158346,-0.535797255504531,0.12198996802381404,0.03385559397275337,3012.083989070962,234942.55114753504,False,False,0.9789627246175969,1.0214893528153697
