78389,78389,sell,apartment,Palermo Soho,|Argentina|Capital Federal|Palermo|Palermo Soho|,Argentina,Capital Federal,3430234.0,"-34.5870626167,-58.4211985185",-34.5870626167,-58.421198518500006,95000.0,USD,1676227.5,95000.0,45.0,45.0,2111.1111111111113,2111.1111111111113,,,,http://www.properati.com.ar/1au3f_venta_departamento_palermo-soho_paraguay_4200_balcon_lavadero_subte-linea-d_r-caizza-negocios-inmobiliarios,"DEPTO DE DOS AMB AL CONTRA FRENTECOCINA TIPO PASILLO,LAVADERO EXTERNOLIVING AMPLIO, BALCÓN CORRIDOBAÑO COMPLETO Y DORMITORIO",DEPTO DE DOS AMB SOHO PALERMO,https://thumbs4.properati.com/6/JI7F01O2rLVqTO9-La7hcUURCfI=/trim/198x0/smart/filters:strip_icc()/tbcn.s3-accelerate.amazonaws.com/pictures/46853656783071027998166126963451837754411737431493062497361899192958620857447.jpg,True,True,,,,,3.0,False,False,False,False,False,False,False,False,False,False,Palermo Soho,1.3862943611198906,1.9218120556728056,0.0,0.0,False,3.8066624897703196,14.490679311024369,0,0,0,0,0,0,0,0,0,0,0,1,0,0,0,0,0,0,0,0,0,0,0,0,0,0,0,0,0,0,0,0,0,0,0,0,0,0,0,0,0,1,0,0,0,0,0,0,0,0,0,0,0,0,0,0,0,0,0,0,0.29835701951596716,0.1955983781628041,-0.258319369282631,-1.0085025601740178,-0.6327913484326282,-0.6112652656822354,2917.02059519942,131265.9267839739,False,False,0.7237217024060082,1.3817465977260408
37726,37726,sell,apartment,Flores,|Argentina|Capital Federal|Flores|,Argentina,Capital Federal,3433918.0,"-34.6374837,-58.4601452",-34.637483700000004,-58.46014520000001,96000.0,USD,1693872.0,96000.0,47.0,47.0,2042.5531914893616,2042.5531914893616,,2.0,,http://www.properati.com.ar/18jp2_venta_departamento_flores_luminoso_estrenar_montesano-propiedades,"MUY LINDO DEPARTAMENTO DE 2 AMBIENTES A ESTRENAR, 7 PISO , CONTRAFRENTE M2 CUBIERTOS 42 DESCUB 8,84 TOTAL 60,13.MUY LUMINOSO Y VISTA ABIERTA NO DUDE EN CONSULTAR.DISPONEMOS DE OTRO 2 AMBIENTES EN MISMO EDIFICIO. A 200 MTS DE GAONA Y 500 DEL METRO BUS.",   DEPARTAMENTO 2 AMBIENTES FLORES,https://thumbs4.properati.com/6/R0_Jt1eZMUWRgwzqT8sNb6DmqG8=/trim/198x0/smart/filters:strip_icc()/static.sumaprop.com/12984/630117/files/6372628.jpg,True,True,,2.0,,2.0,2.0,False,False,False,False,False,False,False,False,False,False,Flores,1.0986122886681098,1.206948960812582,0.0,0.0,False,3.8501476017100584,14.823636554953715,0,0,0,0,0,0,0,0,0,0,0,1,0,0,0,0,0,0,0,0,0,0,0,0,0,0,0,0,0,1,0,0,0,0,0,0,0,0,0,0,0,0,0,0,0,0,0,0,0,0,0,0,0,0,0,0,0,0,0,0,-0.6296877615083525,-0.7256302791069891,-0.24576090225847647,-1.0085025601740178,-0.5731204664848243,-0.5634286193765318,1987.4061124469922,93408.08728500863,False,False,1.0277482688097752,0.97300090921884
35505,35505,sell,house,Capital Federal,|Argentina|Capital Federal|,Argentina,Capital Federal,3433955.0,,,,645000.0,USD,11380702.5,645000.0,1304.0,264.0,494.6319018404908,2443.181818181818,,,,http://www.properati.com.ar/18elk_venta_casa_capital-federal_balcon_suite_jardin_lavadero_parrilla_piscina_terraza_toilette_vestidor_luminoso_vista_impecable_placard_pratto-propiedades,"Casa sobre lotazo de 1300 interno, Excelente ubicaciÃ³n! cerca a la entrada de adelante y la deatrÃ¡s.PB: Amplio living con espacio privado, comedor, todo con vistas al imponente jardin, placard deentrada, play con muebles empotrados en una pared + escritorio, toilette, cocina amplia conmucho mueble de guardado, comedor diario con bajo escalera tambien de guardado muy amplio,lavadero, cuarto de servicio con baÃ±o.Parrilla muy grande con cerramiento, doble galeria.Pileta re bien ubicada con sol todo el dia, con venecitas y solarium, gran tamaÃ±o. Riego.PA: 2 cuartos que comparten un baÃ±o amplio, con balcon y terraza con losa para posibleampliacion a 4to cuarto.cuarto principal en suite con un baÃ±o divino con doble bacha, super luminoso todo, vestidor +placard con espejos de piso a techo, balcon amplio.Entrada para dos autos semicubierto y lugar de guardado.Casa Super Recomedable, excelente calidad de materiales, estado impecable, doble pared, doblevidrio, digna de conocer.","Casa 1304m² con 2 Plantas, Argentina, Capital Federal, por U$S 645.000",https://thumbs4.properati.com/4/pe8UEju6nAynVk-DWUPxCv-OTvQ=/trim/198x0/smart/filters:strip_icc()/sistemadixon.com/get/img_properati.php%3Fc=37005258&n=0&w=800&h=600,True,True,2.0,2.0,,2.0,2.0,True,True,False,False,False,True,False,False,False,False,Capital Federal,1.0986122886681098,1.206948960812582,1040.0,6.947937068614969,True,7.1731917424865985,51.454679774477924,1,1,0,0,0,1,0,0,0,0,1,0,1,0,0,0,0,0,0,0,0,0,1,0,0,0,0,0,0,0,0,0,0,0,0,0,0,0,0,0,0,0,0,0,0,0,0,0,0,0,0,0,0,0,0,0,0,0,0,0,-0.6296877615083525,-0.7256302791069891,1.1168327698622913,3.729779295334478,3.9868074211656617,4.699428069433523,426.0695343926602,555594.672848029,False,False,1.1609182584377047,0.8613870896868665
77299,77299,sell,apartment,Palermo,|Argentina|Capital Federal|Palermo|,Argentina,Capital Federal,3430234.0,,,,243100.0,USD,4289377.95,243100.0,70.0,59.0,3472.857142857143,4120.338983050848,,,1.0,http://www.properati.com.ar/1asnx_venta_departamento_palermo_balcon_roilands-real-estate-trading_gft,"FINANCIACIÓN. 30% anticipo + 20 cuotas en pesos (ajustadas por CAC)Unidad de 3 ambientes, amplio balcón, frente, excelentes detalles de terminación.Ubicado en los limites de Palermo, cercano a avenidas principales de la ciudad y zonas comerciales. Un edificio con buena iluminación natural, amplios balcones y tipologías para diferentes usos y estilos de vida.Entrega Agosto 2019ROILANDS REAL ESTATE NETWORKAv. Libertador 6810 4to. A, CABA, Tel.  Corredor responsable: Mariano Mussi C.U.C.I.C.B.A Nro. 4065Av. Libertador San Martín 23, Los Cardales, Tel. Corredor responsable: Fabian Jose Mussi C.M.Z.C Nro. 217 T.1 F.73",Departamento - Palermo,https://thumbs4.properati.com/0/iVSUFUsub8LiFpK29nADdscxxyU=/trim/198x0/smart/filters:strip_icc()/tbcn.s3-accelerate.amazonaws.com/water_pics/84346667835339535312273973947730921459075525900212390394247862158195128298887.jpg,True,True,3.0,3.0,,3.0,3.0,False,False,False,False,False,False,False,False,False,False,Palermo,1.3862943611198906,1.9218120556728056,11.0,2.4849066497880004,True,4.248495242049359,18.049711821716045,0,0,0,0,0,0,0,0,0,0,1,1,0,0,0,0,0,0,0,0,0,0,0,0,0,0,0,0,0,0,0,0,0,0,0,0,0,0,1,0,0,0,0,0,0,0,0,0,0,0,0,0,0,0,0,0,0,0,0,0,0.29835701951596716,0.1955983781628041,-0.17041010011354923,0.6861282309580617,-0.026502234161713222,-0.09993180618079396,2820.895281877904,197462.66973145326,False,False,1.2311187746555485,0.8122693119352252
117542,117542,sell,apartment,Belgrano,|Argentina|Capital Federal|Belgrano|,Argentina,Capital Federal,3436077.0,,,,115000.0,USD,2029117.5,115000.0,41.0,41.0,2804.8780487804884,,,,,http://www.properati.com.ar/1cdoh_venta_departamento_belgrano_balcon_lavadero_sum_terraza_luminoso_lujoso_amenities_zuker-servicios-inmobiliarios_gsp,"                         MONOAMBIENTE  AL FRENTE CON BALCÓN TERRAZA,  SUPER LUMINOSO . Piso de madera, agua caliente central, calefacción por piso radiante eléctrico. Cocina con anafe a gas y horno eléctrico. Campana de acero . Detalles de diseño y categoríaEXCLUSIVA TORRE DE CATEGORÍA , 5 PISOS DE VIVIENDAS Y ESTUDIOS CON AMPLIAS VISUALES, UBICADA EN UNA EXCELENTE AMENITIES EN EL ÚLTIMO PISO : SPA, SUM ,LAUNDRY , PISICINA Y SOLARIUM ",Departamento - Belgrano,https://thumbs4.properati.com/2/gbcvmpVEwE8BkbfoUbBwliJ91_w=/trim/198x0/smart/filters:strip_icc()/tbcn.s3-accelerate.amazonaws.com/pictures/62483147059593338176307158442676897763720140579634386940071764574090850094510.jpg,True,True,,,,,3.0,False,False,False,False,True,True,False,False,False,False,Belgrano,1.3862943611198906,1.9218120556728056,0.0,0.0,False,3.713572066704308,13.790617494606504,0,0,0,0,1,1,0,0,0,0,0,1,0,0,0,0,0,0,1,0,0,0,0,0,0,0,0,0,0,0,0,0,0,0,0,0,0,0,0,0,0,0,0,0,0,0,0,0,0,0,0,0,0,0,0,0,0,0,0,0,0.29835701951596716,0.1955983781628041,-0.2834363033309401,-1.0085025601740178,-0.7605313356940352,-0.7118445746316333,2988.238299214212,122517.77026778269,False,False,0.9386393479790618,1.0653719153720231
35568,35568,sell,apartment,Caballito,|Argentina|Capital Federal|Caballito|,Argentina,Capital Federal,3435874.0,"-34.608398,-58.44924",-34.608398,-58.44924,210000.0,USD,3705345.0,210000.0,78.0,78.0,2692.3076923076924,2692.3076923076924,5.0,4.0,,http://www.properati.com.ar/18ere_venta_departamento_caballito_balcon_baulera_lavadero_toilette_luminoso_garage_doble-circulacion_re-max-premium-ii,"Corredor Responsable: Ariel Champanier - CUCICBA 4330Contacto: Veronica Pikman - MLS ID # 420511016-110Departamento de 4 ambientes ubicado en un 5to piso al frente, con cochera y baulera. Ingresando a la propiedad nos encontramos con el living - comedor de cómodas medidas con salida al balcón corrido. La cocina se encuentra separada. Es muy amplia, posee gran espacio de guardado y un lugar cómodo para poner una mesa para comer. Fue refaccionada y modernizada. Desde la cocina salimos hacia el lavadero con espacio para lavarropas y lugar para poder colgar la ropa. Tiene ventilación al exterior y es muy luminosa. Posee doble circulación. La unidad cuenta con 3 dormitorios. El principal  y otro de ellos ventilan hacia el frente. Y el tercer dormitorio da al lavadero.  El departamento posee un baño completo de cómodas medidas y un toilette.  El estado del departamento es muy bueno. Se cambiaron todas las cañerías de gas y se hizo a nuevo la cocina.  Posee una superficie total de 78 mts de los cuales 68,33 son cubiertos y 9,23 de balcón. Tiene espacio guarda coche cubierto y una baulera. Las expensas son de $3400 aprox. El edificio tiene de aproximadamente 35 años de antigüedad. El mismo está en buen estado de conservación. Está ubicado en el barrio de Caballito, a media cuadra de Av. Gaona, a una cuadra de Av. San Martín y a dos cuadras de Av. Honorio Pueyrredón. En la zona del Cid campeador o sea en el medio de la capital, con fácil comunicación para los diferentes puntos de la ciudad. Es un barrio donde encontramos una gran cantidad de centros comerciales. supermercados, colegios y espacios verdes.  Transportes Cercanos Colectivos: 24, 57, 76, 92, 99, 105, 106, 110, 124, 135, 146     ",Departamento  4 amb. Balcón y Cochera. Luminoso!!!,https://thumbs4.properati.com/8/lqXTYx_cRo5Zs0ckJiWLhq_E9EA=/trim/198x0/smart/filters:strip_icc()/remax.com.ar/UserImages/42/L_3fa812a86c194ac2bc306c4d2bb03ff4_iList.jpg,True,True,4.0,4.0,4.0,4.0,4.0,False,False,False,False,False,False,False,False,True,False,Caballito,1.6094379124341003,2.5902903939802346,0.0,0.0,False,4.356708826689592,18.980911800555,0,0,0,0,0,0,0,0,1,0,0,1,0,0,0,0,0,0,0,0,0,1,0,0,0,0,0,0,0,0,0,0,0,0,0,0,0,0,0,0,0,0,0,0,0,0,0,0,0,0,0,0,0,0,0,0,0,0,0,0,1.018204476298646,1.0570519997591272,-0.051104663384081074,-1.0085025601740178,0.12198996802381404,0.03385559397275337,2491.914241469356,194369.3108346098,False,False,1.0804174748486426,0.925568146831475
42133,42133,sell,apartment,Recoleta,|Argentina|Capital Federal|Recoleta|,Argentina,Capital Federal,3429595.0,"-34.5895459,-58.3973636",-34.5895459,-58.39736360000001,230000.0,USD,4058235.0,230000.0,72.0,72.0,3194.444444444445,3194.4444444444453,,3.0,7700.0,http://www.properati.com.ar/18vum_venta_departamento_recoleta_lavadero_toilette_luminoso_garage_subte-linea-d_subte-linea-h_pilar-recoleta_6nt,"Muy lindo departamento al frente, luminoso reciclado con cochera espacio.Living y comedor o tercer dormitorio. Baño y toilette. cocina, lavadero integrado. Ideal inversión. Venta con rentaLas medidas y superficies son meramente referenciales. Los valores definitivos surgen del Título de Propiedad Venta supeditada al cumplimiento por parte del propietario de los requisitos de la RG 2371 AFIP","Muy lindo departamento al frente, luminoso reciclado con cochera",https://thumbs4.properati.com/8/9I7fj9J8ZHT9XIcAFtzTBhDHmIc=/trim/198x0/smart/filters:strip_icc()/static.sumaprop.com/209/633841/files/6414471.jpg,True,True,,3.0,,3.0,3.0,False,False,False,False,False,False,False,False,True,False,Recoleta,1.3862943611198906,1.9218120556728056,0.0,0.0,False,4.276666119016055,18.28987309353985,0,0,0,0,0,0,0,0,1,0,0,1,0,0,0,0,0,0,0,0,0,0,0,0,0,0,0,0,0,0,0,0,0,0,0,0,0,0,0,0,0,0,0,0,0,0,1,0,0,0,0,0,0,0,0,0,0,0,0,0,0.29835701951596716,0.1955983781628041,-0.0887800644565447,-1.0085025601740178,0.012154239257863238,-0.06542734644601444,3289.8353852379114,236868.14773712962,False,False,0.9710043422775793,1.0298615119005634
117307,117307,sell,apartment,Coghlan,|Argentina|Capital Federal|Coghlan|,Argentina,Capital Federal,3435359.0,"-34.5654673333,-58.471218786",-34.5654673333,-58.471218786,101000.0,USD,1782094.5,101000.0,40.0,36.0,2525.0,2805.555555555556,,,,http://www.properati.com.ar/1cdft_venta_departamento_coghlan_monroe-av-_3600_sf-grupo-inmobiliario_ezs,"Departamento 40m² con Pavimento en Monroe Av. 3600, Capital Federal, Coghlan, por U$S 101.000",Departamento - Coghlan,"https://thumbs4.properati.com/4/QTYsaU5xRbFKccAP4n2HyBsEs94=/trim/198x0/smart/filters:strip_icc()/maps.googleapis.com/maps/api/staticmap%3Fkey=AIzaSyCtB7aox9MJ3hCrd_u4KJ5N0v8syKusnaA&center=-34.5654673333,-58.471218786&zoom=19&size=800x600&maptype=satellite&sensor=false",True,True,,,,,3.0,False,False,False,False,False,False,False,False,False,False,Coghlan,1.3862943611198906,1.9218120556728056,4.0,1.6094379124341003,True,3.6888794541139363,13.607831626983932,0,0,0,0,0,0,0,0,0,0,1,1,0,0,0,0,0,0,0,0,0,0,0,0,0,1,0,0,0,0,0,0,0,0,0,0,0,0,0,0,0,0,0,0,0,0,0,0,0,0,0,0,0,0,0,0,0,0,0,0,0.29835701951596716,0.1955983781628041,-0.31483247089132643,0.08908516734035389,-0.7944148858365481,-0.7381057930269825,2522.416703713283,100896.66814853132,False,False,1.0010241354185905,0.9989769123616962
21781,21781,sell,apartment,Congreso,|Argentina|Capital Federal|Congreso|,Argentina,Capital Federal,3435259.0,"-34.6104998,-58.3948047",-34.6104998,-58.3948047,160000.0,USD,2823120.0,160000.0,70.0,70.0,2285.714285714286,2285.714285714286,2.0,3.0,1700.0,http://www.properati.com.ar/17gf3_venta_departamento_congreso_sarandi-100_luminoso_subte-linea-b_subte-linea-a_nexo-propiedades_b76,"Venta de Departamento 3 ambientes. Luminoso, moderno y espacioso. Dos habitaciones , baño completo, cocina a gas a nueva .Ubicado en la mejor zona de Congreso con fácil acceso a medios de transporte público Subte A , ferrocarril, a dos cuadras de Avenida  . Telefono:  -  - NEXO PROPIEDADES",DEPARTAMENTO EN VENTA,https://thumbs4.properati.com/3/eT3AFXUqpw0Xj4LaNC5UAxcVjEs=/trim/198x0/smart/filters:strip_icc()/xintelweb.com/upload/NXP901_2.jpg%3F1501537860,True,True,3.0,3.0,,3.0,3.0,False,False,False,False,False,False,False,True,False,False,Congreso,1.3862943611198906,1.9218120556728056,0.0,0.0,False,4.248495242049359,18.049711821716045,0,0,0,0,0,0,0,1,0,0,0,1,0,0,0,0,0,0,0,0,0,0,0,0,0,0,0,1,0,0,0,0,0,0,0,0,0,0,0,0,0,0,0,0,0,0,0,0,0,0,0,0,0,0,0,0,0,0,0,0,0.29835701951596716,0.1955983781628041,-0.10133853148069924,-1.0085025601740178,-0.026502234161713222,-0.09993180618079396,1796.4782567359598,125753.47797151719,False,False,1.2723306152712497,0.7859592373219824
22816,22816,sell,PH,San Cristobal,|Argentina|Capital Federal|San Cristobal|,Argentina,Capital Federal,3429153.0,"-34.6217712,-58.3967837",-34.621771200000005,-58.39678370000001,340000.0,USD,5999130.0,340000.0,381.0,166.0,892.3884514435697,2048.192771084337,,5.0,,http://www.properati.com.ar/17jv5_venta_ph_san-cristobal_balcon_suite_terraza_toilette_dependencias_placard_subte-linea-e_subte-linea-h_franca-propiedades_eqx,"Apto profesional. PH señorial al frente. Superficie total de 381m², cubierta de 166m² y descubierta de 215m². 1º piso por escalera. 4 dormitorios (uno en suite), 2 dependencias de servicio en terraza y 3 baños (uno completo, un toilette y uno de servicio). Terraza, 2 balcones, living-comedor de 62m². Instalación eléctrica nueva. Cocina y baños a reciclar. Pisos de roble. Placard en todas las habitaciones, y persianas en todas las ventanas. 40 años de antigüedad. Sin expensas. 2 unidades en el lote con acceso independiente.Colectivos: 6, 8, 12, 23, 37, 50, 53, 56, 61, 84, 86, 90, 91, 95, 96, 118, 126, 129, 150, 151, 188, 195.Subte: ENTRE RIOS (Línea E).Venta sujeta a la obtención del COTI por parte del propietario.Las reservas se toman exclusivamente en la inmobiliaria con el matriculado - Matricula CPI 6099.",Pasco 1100 San Cristóbal PH 5amb U$340.000 Apto prof,https://thumbs4.properati.com/4/jPgyqpt2F-TB8yomzSZlNgNodmo=/trim/198x0/smart/filters:strip_icc()/static.sumaprop.com/7641/596673/files/6018407.jpg,True,True,4.0,5.0,,5.0,5.0,False,False,False,False,False,True,False,True,False,False,San Cristobal,1.791759469228055,3.210401995568401,215.0,5.375278407684165,True,5.942799375126701,35.31686441300631,0,0,0,0,0,1,0,1,0,0,1,0,0,0,0,0,0,0,0,0,0,0,0,0,0,0,0,0,0,0,0,0,0,0,0,0,0,0,0,0,0,0,0,0,0,0,0,0,0,1,0,0,0,0,0,0,0,0,0,0,1.6063626740230428,1.856176450574687,0.5014678856787188,2.6572738992137603,2.298445716958622,2.380875223178939,775.7066570152168,295544.2363227976,False,False,1.1504199988141444,0.8692477538905811
92484,92484,sell,apartment,Caballito,|Argentina|Capital Federal|Caballito|,Argentina,Capital Federal,3435874.0,"-34.6273106938,-58.4296005699",-34.6273106938,-58.429600569899996,237598.0,USD,4192297.91,237598.0,73.0,65.0,3254.7671232876714,3655.353846153846,,,,http://www.properati.com.ar/1bcwl_venta_departamento_caballito_doblas_900_garage_subte-linea-e_soldati-propiedades_gjr,"Esta torre está situada en una ubicación estratégica en un lote de más de 3.900 m2 y contará con unidades desde 29 m2 en sus 24 pisos. Departamentos de 1,2,3 y 4 ambientes , 200 cocheras en dos subsuelos y amenities de gran categoría, además de vistas panorámicas a toda la ciudad.Arquitectura de Alta Gama. Hall con jardín interno y altura infinita.Increíble piscina de 50 metros con gran parque.Obra ya iniciada.La unidad publicada es la  19°38CUCICBA Mat. 1544",Departamento de dos dormitorios con suite en Caballito,https://thumbs4.properati.com/7/msSyspqYGaZkgUE8JJI74yzq4H8=/trim/198x0/smart/filters:strip_icc()/tbcn.s3-accelerate.amazonaws.com/pictures/114226274925870049943417222984144371492510585480465042273809111628531019265369.jpg,True,True,4.0,4.0,,4.0,4.0,True,False,False,False,True,False,False,False,True,False,Caballito,1.6094379124341003,2.5902903939802346,8.0,2.1972245773362196,True,4.290459441148391,18.408042216139364,1,0,0,0,1,0,0,0,1,0,1,1,0,0,0,0,0,0,0,0,0,1,0,0,0,0,0,0,0,0,0,0,0,0,0,0,0,0,0,0,0,0,0,0,0,0,0,0,0,0,0,0,0,0,0,0,0,0,0,0,1.018204476298646,1.0570519997591272,-0.1327346990410856,0.48993780341219406,0.031081629804016523,-0.04844974759477026,2821.2098736477615,205948.3207762866,False,False,1.1536777726781915,0.8667931580917625
66506,66506,sell,apartment,Belgrano,|Argentina|Capital Federal|Belgrano|,Argentina,Capital Federal,3436077.0,,,,143000.0,USD,2523163.5,143000.0,43.0,34.0,3325.5813953488373,4205.882352941177,,,,http://www.properati.com.ar/1adwn_venta_departamento_belgrano_balcon_lavadero_luminoso_garage_aire-acondicionado_estrenar_belga-inmobiliaria_gdd,"DEPARTAMENTOS A ESTRENAR - MODERNO Y EXCLUSIVO EDIFICIO CON EXCELENTES DETALLES CONSTRUCTIVOSESPECTACULAR MONOAMBIENTE AL CONTRAFRENTE CON BALCÓN - COCHERA FIJAMonoambiente - Cocina integrada - Balcón - Baño Completo - Lavadero Detalles: - Confort térmico mediante piso radiante con termostatos individuales en cada ambiente- Pre-instalación de aires acondicionados en todos los ambientes, ubicación de equipos definida- Aberturas de aluminio anodizado linea Modena 2 de Aular con vidrios laminados 3+3- Pisos y revestimientos Ilva (línea soho y art)- Puertas de acceso Oblak premium luxor cedro (h) rf - 30 con cerradura multipunto- Puertas de interiores Oblak linea master pantografiada dommo (h)- Terminación de paredes interiores con yeso proyectado- Frentes integrales de placar piso - techo - Cielorraso enlucidos de yeso + suspendidos de durlock con artefactos embutidos- Mesadas de Corian By Dupont en cocinas- Muebles de cocina en melanina Masisa Color ceniza y bordes de pvc- Extractor Spar embutido proyectable colocado con salida al exterior- Horno embutido y anafe sobre mesada- Artefactos Ferrum murano, griferias FV oregon- Calderas individuales Peisa acqua para agua caliente- Revestimiento Tarquini en Manto Q y paredes exterioresUbicación: Ibera 2835 1B (Entre Av. Cramer y Vidal)Visitar solo acompañado con personal de la firma Solicitar visita al  ó al ",Ibera 2835 2B,https://thumbs4.properati.com/0/2MkXNd2TL8V0JMea2oAq9GR59PI=/trim/198x0/smart/filters:strip_icc()/tbcn.s3-accelerate.amazonaws.com/pictures/46132129242544388312941781645582177469494772400477003770976086579865681796528.jpg,True,True,,,,,3.0,False,False,False,False,False,False,False,False,True,False,Belgrano,1.3862943611198906,1.9218120556728056,9.0,2.302585092994046,True,3.7612001156935624,14.146626310293268,0,0,0,0,0,0,0,0,1,0,1,1,0,0,0,0,0,0,1,0,0,0,0,0,0,0,0,0,0,0,0,0,0,0,0,0,0,0,0,0,0,0,0,0,0,0,0,0,0,0,0,0,0,0,0,0,0,0,0,0,0.29835701951596716,0.1955983781628041,-0.327390937915481,0.5617904720098409,-0.6951754572825817,-0.6606960619975789,3127.307637314992,134474.22840454464,False,False,1.063400784645567,0.9403792196122004
63168,63168,sell,apartment,Retiro,|Argentina|Capital Federal|Retiro|,Argentina,Capital Federal,3429576.0,"-34.5926272,-58.3788196",-34.5926272,-58.3788196,395000.0,USD,6969577.5,395000.0,148.0,128.0,2668.918918918919,3085.9375,,4.0,,http://www.properati.com.ar/1a8be_venta_departamento_retiro_balcon_suite_lavadero_patio_toilette_vestidor_luminoso_dependencias_estrenar_subte-linea-h_subte-linea-c_pinto-kramer-group_ep9,"LIVING Y COMEDOR, BALCÓN, PATIO, 2 DORMITORIOS (SUITE), COMEDOR DIARIO, 1 DEPENDENCIAMuy luminoso!!RECICLAJE A FULL A ESTRENAR!Antigüedad: 85 añosOrientación: suresteSuperficie Total: 148 m2Superficie cubierta: 128 m2Palier semi privadoHall 3,9 x 1,5Living 5,2 x 3,8 a balcón, con Hogar y Aire Acond Split f/cBalcón al fte. 2,5 x 1Comedor 3,9 x 3,8 con salida al hall y al patio1er. Dormitorio 3,5 x 2,9 (semisuite) con Aire Acond Split f/c2do. Dormitorio 3,7 x 3,3 (suite con hidro y vestidor) con Aire Acond Split f/c, con salida al patioPatio 5,7 x 2,5 con salida a hall de recepción2 Baños completos (uno en suite y otro en semi suite como toilette)Cocina 4,2 x 1,5Comedor diario 3 x 1,81 Dependencia 2 x 1,9 con lavadero incorporado y buen bañoDoble circulaciónEdificio SIN COCHERASNro de pisos: 10Deptos por piso: 2Tipo de piso: tirantes de pinotea y cemento alisado1 AscensorServicos individuales:      Calefacción: 3 Aires Acond Split f/c      Agua caliente: termotanquePortero en horario de porteríaExpensas: $5.860ABL: $IDEAL PROFESIONAL POR SU CIRCULACIÓN !!!.  Planta con excelentes placards. Cocina equipada con horno eléctrico, anafe eléctrico y campana de Acero inoxidable.",APTO PROFESIONAL !!! Edificio Francés!!! Excelente ubicación Impecable semi piso al fte. con amplios ambientes,https://thumbs4.properati.com/3/MuvXauNl83ri1bddGDRV05SQfCY=/trim/198x0/smart/filters:strip_icc()/static.sumaprop.com/12107/701412/files/7310128.jpg,True,True,,4.0,,4.0,4.0,False,False,False,False,False,False,False,False,True,False,Retiro,1.6094379124341003,2.5902903939802346,20.0,3.044522437723423,True,4.997212273764115,24.97213050905871,0,0,0,0,0,0,0,0,1,0,1,1,0,0,0,0,0,0,0,0,0,0,0,0,0,0,0,0,0,0,0,0,0,0,0,0,0,0,0,0,0,0,0,0,0,0,0,1,0,0,0,0,0,0,0,0,0,0,0,0,1.018204476298646,1.0570519997591272,0.26285701221978247,1.0677691853657112,1.000897802744564,0.8946262049873706,2573.465851781052,380872.9460635957,False,False,1.0370912507239238,0.9642353064901157
96645,96645,sell,PH,Liniers,|Argentina|Capital Federal|Liniers|,Argentina,Capital Federal,3431333.0,"-34.6417957979,-58.5107800056",-34.6417957979,-58.510780005600004,86000.0,USD,1517427.0,86000.0,50.0,50.0,1720.0,1720.0,,,,http://www.properati.com.ar/1bizj_venta_ph_liniers_pola_300_balcon_baulera_placard_gustavo-vega-compromiso-inmobiliario_gle,"Monoambiente amplio dividido con entrepiso de madera para 2 ambientes en duplex. Pola al 300, 2do piso por escalera.Planta baja: Cocina-comedor integrada con alacenas y bajomesada, baño totalmente completo.Planta alta: Dormitorio con placard.Baulera en el primer piso. Termotanque a gas. Balcon al contrafrente semicubierto. Todo refaccionado a nuevo.Muy buenos detalles en madera.Excelente oportunidad, digno de visitar.35 metros cubiertos aprox.1 metro semicubierto.13 metros cubiertos en el entrepiso aprox.Precio: U$S 86.000GUSTAVO VEGA COMPROMISO INMOBILIARIOTel. Ercilla 6004 . Liniers . CABA",Monoambiente amplio en duplex. Pola al 300.,https://thumbs4.properati.com/9/UBRw9CpQzvc2f00vshhyitJBXxY=/trim/198x0/smart/filters:strip_icc()/tbcn.s3-accelerate.amazonaws.com/pictures/111068753575526084079176725013294766968485433579545584823084975288217386532071.jpg,True,True,2.0,2.0,,2.0,2.0,False,False,False,False,False,False,False,False,False,False,Liniers,1.0986122886681098,1.206948960812582,0.0,0.0,False,3.912023005428146,15.303923994999064,0,0,0,0,0,0,0,0,0,0,0,0,0,0,0,0,0,0,0,0,0,0,0,0,0,0,0,0,0,0,0,0,1,0,0,0,0,0,0,0,0,0,0,0,0,0,0,0,0,0,0,0,0,0,0,0,0,0,0,0,-0.6296877615083525,-0.7256302791069891,-0.22692320172224467,-1.0085025601740178,-0.4882141676151961,-0.4944247433131038,1738.840237230779,86942.01186153895,False,False,0.9891650556345629,1.0109536262969645
